STATION CODE,LOCATIONS,STATE,Temp,DO,PH,Conductivity,BOD,NI,Fec_col,Tot_col,year,WQI,WQI clf
1427,"UMTREW AT BYRNIHAT EAST, MEGHALAYA",MEGHALAYA,18.0,9.6,7.1,225.0,4.4,3.0,310.0,460.0,2009.0,72.06884782608697,1
1428,"KHARKHLA NEAR SUTNGA KHLIERIAT,JAINTIA HILLS DT.,MEGHALAYA",MEGHALAYA,19.0,8.8,7.2,131.0,0.9,0.52,233.0,205.0,2009.0,44.62191681159421,2
2050,TLAWNG UPSTREAM AIZAWL,MIZORAM,24.0,7.4,7.8,272.0,0.9,0.52,8.0,295.0,2009.0,56.85145420289855,1
2051,TLAWNG DOWNSTREAM AIZAWL,MIZORAM,24.0,7.5,7.8,327.0,1.2,0.52,0.0,56.0,2009.0,58.80868724637681,1
2052,TUIRIAL UPPER CATCHMENT,MIZORAM,26.0,8.1,7.8,365.0,1.3,0.52,13.0,33.0,2009.0,57.09796550724639,1
2053,TUIRIAL LOWER CATCHMENT,MIZORAM,26.0,7.9,7.5,350.0,1.8,0.52,41.0,90.0,2009.0,57.90617942028985,1
1403,"GUMTI AT U/S SOUTH TRIPURA,TRIPURA",TRIPURA,28.0,6.6,7.7,143.0,1.3,0.0,201.0,322.0,2009.0,66.69095652173914,1
1404,"GUMTI AT D/S SOUTH TRIPURA, TRIPURA",TRIPURA,29.0,6.3,7.6,164.0,2.8,0.1,442.0,577.0,2009.0,85.07397072463768,0
1726,"CHANDRAPUR, AGARTALA D/S OF HAORA RIVER, TRIPURA",TRIPURA,28.0,5.7,7.8,170.0,3.4,0.2,469.0,608.0,2009.0,97.35946579710144,0
1631,MYNTDU JAINTIA HILLS MEGHALAYA,MEGHALAYA,21.0,6.4,7.025,187.63,3.175,2.675,2225.0,2925.0,2009.0,118.13797570144928,0
1633,"SIMSANG, WILLIAMNAGAR, MEGHALAYA",MEGHALAYA,25.0,8.35,7.125,110.75,1.525,3.075,252.5,355.0,2009.0,51.756149782608695,1
1632,"GANOL, TURA, MEGHALAYA",MEGHALAYA,24.0,8.45,6.95,104.25,1.2,2.6,222.5,312.5,2009.0,44.63444949275363,2
1393,"DAMANGANGA AT D/S OF MADHUBAN, DAMAN",DAMAN & DIU,27.0,6.7,7.6,281.0,1.8965,2.13,233.0,465.0,2008.0,70.75598756521738,1
1150,"DAMANGANGA AT KACHIGAON U\S AT GIDC WIER,GUJARAT",GUJARAT,25.0,7.2,7.8,262.0,0.28,0.15,19.0,50.0,2008.0,52.47193478260869,1
1246,"DAMANGANGA AT KACHIGAON D\S (DAMAN),GUJARAT",GUJARAT,25.0,4.9,7.4,10362.0,9.7,0.64,14.0,29.0,2008.0,142.13922811594205,0
1860,BALEHWAR KHADI AT N.H. NO. 8,GUJARAT,27.0,5.1,7.8,530.0,2.73,0.6,64125.0,137000.0,2008.0,1531.2419208695655,0
1861,RIVER PURNA ON BRIDGE AT SURATNANNAVSARI HIGHWAY,GUJARAT,28.0,6.0,8.2,612.0,2.28,0.4,28650.0,68650.0,2008.0,730.834411594203,0
1862,RIVER KAVERI ON BRIDGE AT BILLIMORANANVALSAD ROAD,GUJARAT,30.0,6.1,8.1,8782.0,1.9,0.43,16100.0,38667.0,2008.0,443.1029846376811,0
1865,RIVER DHADAR AT KOTHADA,GUJARAT,27.0,1.1,7.8,1076.0,7.67,0.63,28.0,77.0,2008.0,147.6709191304348,0
1148,"AMBIKA AT BILIMORA, GUJARAT",GUJARAT,29.0,6.8,8.0,3431.0,2.8,0.3,32120.0,49061.0,2008.0,801.1034226086957,0
1149,"KOLAK AT PATALIA BDG., GUJARAT",GUJARAT,25.0,4.5,7.6,1161.0,7.43,0.53,99.0,259.0,2008.0,127.3343892753623,0
1435,"KOLAK AT RAILWAY BRIDGE NO. 313 VAPI,VALSAD, GUJARAT",GUJARAT,25.0,6.0,7.3,8838.0,5.58,0.7,14.0,31.0,2008.0,98.31275159420292,0
1434,"AMLAKHADI AFTER CONFL. OF W. WATER FROM ANKLESH,GUJARAT",GUJARAT,30.0,0.0,7.1,3080.0,46.0,4.8,3000.0,9000.0,2008.0,548.6490956521739,0
1438,"MINDHOLA AT STATE HIGHWAY BRIDGE SACHIN, GUJARAT",GUJARAT,28.0,2.8,7.9,663.0,5.93,0.97,150250.0,358000.0,2008.0,3524.421534202899,0
1436,"BHADAR D/S JETPUR VILL. AFTER CONF. OF W.WATER FROM JETPUR CITY,GUJARAT",GUJARAT,29.0,5.6,8.0,1265.0,2.13,0.1,503.0,1693.0,2008.0,91.29057942028986,0
2072,RIVER BHOGAVO D/S OF SURENDRANAGAR.,GUJARAT,28.0,4.1,7.9,4491.0,16.5,0.1,58.0,116.0,2008.0,214.50240376811595,0
1399,"ZUARI AT D/S OF PT. WHERE KUMBARJRIA CANAL JOINS, GOA",GOA,30.0,6.6,7.8,37.0,2.25,0.01,10.0,13.0,2008.0,72.52504985507245,1
1475,ZUARI AT PANCHAWADI,GOA,28.0,6.8,7.1,11.0,1.65,0.07,22.0,33.0,2008.0,54.37011594202898,1
1476,"MANDOVI AT TONCA, MARCELA, GOA",GOA,27.0,6.5,7.5,28.0,4.55,0.05,20.0,44.0,2008.0,88.38795014492752,0
1400,"MANDOVI AT NEGHBOURHOOD OF PANAJI, GOA",GOA,28.0,7.1,8.0,49.0,1.25,0.02,3.0,7.0,2008.0,64.5873284057971,1
1543,"RIVER KALNA AT CHANDELNAN PERNEM, GOA",GOA,26.0,7.6,7.3,93.0,0.95,0.03,240.0,350.0,2008.0,52.69822695652174,1
1544,"RIVER VALVANT AT SANKLI NAN BICHOLIM, GOA",GOA,26.0,7.4,7.0,67.0,2.45,0.13,467.0,809.0,2008.0,66.85329420289855,1
1545,"RIVER MADAI AT DABOS NAN  VALPOI, GOA",GOA,27.0,7.0,7.3,89.0,1.5,0.02,30.0,42.0,2008.0,55.74261536231883,1
2270,"RIVER KHANDEPAR AT CODLI NEAR BRIDGE ,U/S OPA WATERWORKS,SANGUEM",GOA,29.0,5.4,7.3,75.0,1.8,0.06,350.0,2400.0,2008.0,73.68766,1
1546,"RIVER KHANDEPAR AT OPA NAN PONDA, GOA",GOA,28.0,6.7,7.2,95.0,1.4,0.1,18.0,22.0,2008.0,54.30514289855073,1
1547,"RIVER TALPONA AT CANACONA, GOA",GOA,28.0,6.8,6.9,58.0,1.9,0.03,25.0,53.0,2008.0,53.18778260869566,1
1548,"RIVER ASSONORA AT ASSONORA, GOA",GOA,25.0,5.6,6.8,67.0,1.9,0.06,82.0,137.0,2008.0,58.508266086956525,1
2271,"RIVER SAL PAZORKHONI,CUNCOLIM(NEAR CULVERT MARGAONAN CANACONA NATIONAL HIGHWAY)",GOA,28.0,5.2,7.2,29.0,1.65,0.04,37.0,144.0,2008.0,64.1601072463768,1
2272,"RIVER KUSHAWATI NEAR BUND AT KEVONA,RIVON,SANGUEM",GOA,26.0,6.2,7.1,146.0,2.1,0.09,920.0,2400.0,2008.0,81.63846434782607,0
2274,RIVER MAPUSA ON CULVERT ON HIGHWAY MAPUSANANPANAJI,GOA,31.0,3.6,7.0,29.0,2.0,0.09,33.0,170.0,2008.0,71.4064852173913,1
2275,"RIVER CHAPORA NEAR ALORNA FORT ,PERNEM",GOA,30.0,6.8,7.2,1370.0,2.6,0.08,33.0,110.0,2008.0,65.07562927536232,1
2276,"RIVER BICHOLIM VARAZAN NAGAR , BICHOLIM",GOA,28.0,8.1,7.1,335.0,3.2,0.21,1300.0,5400.0,2008.0,91.34771217391304,0
1093,"ULHAS AT U/S OF NRC BUND AT MOHANE, MAHARASHTRA",MAHARASHTRA,26.0,6.3,7.6,119.0,3.67,0.37,157.0,781.0,2008.0,86.54121072463768,0
1094,"ULHAS AT U/S OF BADLAPUR, MAHARASHTRA",MAHARASHTRA,27.0,6.4,7.6,109.0,3.4,0.42,95.0,316.0,2008.0,82.2008504347826,0
2162,ULHAS RIVER ATJAMBHUL WATER WORKS.,MAHARASHTRA,27.0,5.9,7.2,119.0,4.04,0.65,133.0,223.0,2008.0,84.17425188405798,0
1461,"BHATSA AT D/S OF PISE DAM NEAR PISE VILLAGE (ULHAS), MAHARASHTRA",MAHARASHTRA,25.0,5.3,7.7,109.0,3.25,0.38,165.0,296.0,2008.0,89.4392336231884,0
1092,"KALU AT ATALE VILLAGE, MAHARASHTRA",MAHARASHTRA,26.0,6.0,7.8,301.0,5.43,0.3,166.0,1050.0,2008.0,107.32645826086954,0
1462,"PATALGANGA NEAR INTAKE OF MIDC W/W, MAHARASHTRA",MAHARASHTRA,22.0,6.6,7.2,131.0,4.5,0.83,285.0,737.0,2008.0,88.3731631884058,0
1151,"PATALGANGA AT SHILPHATA, MAHARASHTRA",MAHARASHTRA,22.0,6.8,7.2,110.0,3.9,0.49,480.0,1036.0,2008.0,86.433275942029,0
1152,"KUNDALIKA AT ROHA CITY, MAHARASHTRA",MAHARASHTRA,27.0,6.7,7.6,109.0,4.13,0.28,260.0,624.0,2008.0,90.91850289855071,0
2198,KUNDALIKA RIVER AT ARE KHURD ( SALINE ZONE ),MAHARASHTRA,29.0,5.2,7.0,478.0,16.3,0.35,500.0,1008.0,2008.0,200.92496057971013,0
2164,VASHISTI RIVER AT U/S OF THREE M PAPER MILLS NEAR M/S MULTIFILMS PLASTIC PVT. LTD. AT KHERDI.,MAHARASHTRA,21.0,6.9,6.6,291.0,1.96,1.4,4.0,104.0,2008.0,47.77798231884057,2
2168,MITHI RIVER,MAHARASHTRA,32.0,0.7,7.3,12697.0,45.6,1.32,642.0,1259.0,2008.0,493.1331269565217,0
2199,SAVITRI RIVER AT OVALE VILLAGE.,MAHARASHTRA,23.0,6.8,6.6,6232.0,2.13,2.72,6.0,106.0,2008.0,51.25988927536231,1
17,"PERIYAR NEAR ALWAYENANELOOR, KERALA",KERALA,29.0,6.2,6.5,1638.0,1.5,0.8,349.0,816.0,2008.0,53.34955101449274,1
18,"PERIYAR AT KALADY, KERALA",KERALA,28.0,7.3,6.6,36.0,0.6,0.41,304.0,1056.0,2008.0,40.490014492753616,2
1338,"PERIYAR AT SEWAGE DISCHARGE POINT, KERALA",KERALA,28.0,6.4,6.7,41.0,1.0,0.75,443.0,1179.0,2008.0,53.23383043478261,1
2335,R PERIYAR AT KALAMASSERY,KERALA,28.0,5.1,6.8,52.0,1.6,0.22,555.0,1680.0,2008.0,69.06505420289855,1
2334,RIVER PERIYAR AT PATHALAM,KERALA,28.0,6.8,6.7,183.0,1.3,0.28,358.0,1748.0,2008.0,52.191615942029,1
2333,RIVER PERIYAR AT MUPPATHADAM,KERALA,27.0,6.3,6.3,115.0,0.9,0.5,455.0,2865.0,2008.0,46.51078405797102,2
2336,R PERIYAR AT PURAPPALLIKAVU,KERALA,28.0,7.2,6.7,455.0,1.1,0.28,245.0,753.0,2008.0,45.84050811594204,2
20,"CHALIYAR AT KOOLIMADU, KERALA",KERALA,27.0,6.8,6.9,80.0,0.4,0.52,207.0,508.0,2008.0,44.090495942028994,2
21,"CHALIYAR AT CHUNGAPALLY, KERALA",KERALA,27.0,6.8,7.0,4515.0,0.4,1.53,184.0,427.0,2008.0,46.38650260869566,2
42,"KALLADA AT PERUMTHOTTAMKADAVU, PUNALOOR, KERALA",KERALA,29.0,7.7,7.2,47.0,1.0,2.0,253.0,452.0,2008.0,51.43874666666667,1
43,"MUVATTAPUZHA AT VETTIKKATTUMUKKU, KERALA",KERALA,29.0,7.1,6.8,57.0,1.5,1.12,230.0,681.0,2008.0,51.255335072463765,1
1154,CHALAKUDY AT PULICKALKANANDAVU,KERALA,29.0,6.6,6.3,148.0,1.2,0.93,190.0,935.0,2008.0,41.496296521739126,2
1155,KARAMANA AT MOONNATTUMUKKU,KERALA,26.0,1.8,6.8,2012.0,5.5,1.8,20458.0,31167.0,2008.0,566.4111104347826,0
1156,"PAMBA AT CHENGANNUR, KERALA",KERALA,26.0,6.7,6.2,40.0,0.6,1.0,425.0,1100.0,2008.0,39.181702898550725,2
1341,"PAMBA AT THAKAZHY, KERALA",KERALA,26.0,5.8,6.3,65.0,1.1,2.97,525.0,1200.0,2008.0,52.126372173913055,1
1565,"PAMBA DOWN, KERALA",KERALA,26.0,5.1,6.3,50.0,1.0,3.1,700.0,1600.0,2008.0,58.575194202898544,1
1339,"MEENACHIL AT KIDANGOOR, KERALA",KERALA,26.0,6.6,6.2,42.0,0.6,1.97,475.0,925.0,2008.0,40.8357831884058,2
1340,"MANIMALA  AT KALLOOPARA, KERALA",KERALA,27.0,6.6,6.4,43.0,0.7,3.13,400.0,975.0,2008.0,43.67352985507247,2
1384,"MANIMALA AT THONDRA, KERALA",KERALA,27.0,6.7,6.4,50.0,0.5,3.6,500.0,1175.0,2008.0,43.7289695652174,2
1342,"ACHENKOIL AT THUMPAMON, KERALA",KERALA,26.0,6.6,6.3,46.0,0.6,1.07,624.0,1010.0,2008.0,45.7858631884058,2
1443,"ACHENKOIL AT CHENNITHULA, KERALA",KERALA,27.0,5.9,6.4,54.0,0.7,3.53,375.0,985.0,2008.0,46.53699188405798,2
1442,"VAMANAPURAM, KERALA",KERALA,27.0,7.6,6.7,55.0,0.7,4.17,295.0,1575.0,2008.0,41.998506956521744,2
1563,"AMARAVILA, KERALA",KERALA,27.0,6.5,6.7,72.0,0.8,2.83,30.0,775.0,2008.0,42.00039681159419,2
1564,"AYUR, KERALA",KERALA,29.0,7.3,7.4,71.0,0.7,4.1,490.0,940.0,2008.0,59.759434492753634,1
1566,"THIRURANGADY, KERALA",KERALA,27.0,6.3,6.7,79.0,0.7,2.03,190.0,702.0,2008.0,45.51138405797102,2
1567,"KUTTIYADY ESTATE, KERALA",KERALA,26.0,6.9,6.6,33.0,0.4,1.4,0.0,28.0,2008.0,33.80698231884057,2
1568,"VALAYAM, KERALA",KERALA,27.0,6.8,6.7,46.0,0.4,1.47,30.0,150.0,2008.0,36.72442260869565,2
1569,"THALIPARAMBA, KERALA",KERALA,29.0,5.9,7.1,6666.0,0.7,4.13,118.0,393.0,2008.0,54.399291884057966,1
1570,"HOSDURG, KERALA",KERALA,28.0,6.4,7.1,17771.0,1.0,5.2,760.0,1865.0,2008.0,71.72158376811595,1
1571,"KAKKADAVU,  KERALA",KERALA,28.0,7.3,6.7,62.0,0.9,2.8,293.0,920.0,2008.0,44.87562115942029,2
1572,"PADIYATHADKA, KERALA",KERALA,28.0,7.6,6.6,61.0,0.5,3.4,85.0,503.0,2008.0,33.53240028985508,2
1573,"IRUMPANAM, KERALA",KERALA,30.0,2.4,6.7,221.0,2.1,3.97,220.0,660.0,2008.0,77.56368202898553,0
2284,R NEYYAR AT ARUVIPURAM,KERALA,27.0,7.1,6.8,89.0,1.2,0.4,620.0,1600.0,2008.0,57.34923507246376,1
2285,R MAMOM AT MAMOM BRIDGE,KERALA,27.0,6.4,6.7,110.0,0.5,0.2,1400.0,3200.0,2008.0,70.35719710144927,1
2286,R AYROOR AT AYROOR BRIDGE,KERALA,27.0,3.5,6.9,105.0,0.7,0.15,265.0,800.0,2008.0,63.93305217391304,1
2287,R ITHIKKARA AT ITHIKKARA,KERALA,28.0,7.4,7.3,155.0,0.8,1.2,570.0,920.0,2008.0,59.892560869565216,1
2288,R PALLICKAL AT NELLIMUKAL,KERALA,28.0,6.8,6.9,77.0,0.9,1.8,215.0,470.0,2008.0,48.82422260869566,2
2289,R KARUVANNURR AT KARUVANNUR BDG.,KERALA,27.0,5.5,6.5,75.0,1.9,0.1,1300.0,2100.0,2008.0,81.1371463768116,0
2290,R PUZHACKAL AT PUZHACKAL BRIDGE,KERALA,31.0,5.4,6.5,102.0,4.0,0.1,320.0,680.0,2008.0,78.24297333333334,0
2291,R KEECHERI AT VADAKKANCHERY BRIDGE,KERALA,30.0,4.8,6.8,90.0,1.1,0.1,730.0,1090.0,2008.0,69.81525507246377,1
2292,R THIRUR AT THALAKKADATHUR BRIDGE,KERALA,28.0,5.8,6.3,87.0,0.7,0.1,633.0,1500.0,2008.0,50.72942550724638,0
2293,R KADALUNDI AT HAJIRAPPALLY,KERALA,27.0,7.3,6.6,57.0,0.4,0.25,297.0,883.0,2008.0,38.51398115942029,2
2294,R KALLAI AT KALLAI BRIDGE,KERALA,28.0,5.8,7.5,18291.0,0.8,0.25,435.0,1000.0,2008.0,71.98210550724639,1
2295,R CORAPUZHA AT KANAYANKODE,KERALA,28.0,6.2,6.7,2497.0,0.5,0.15,510.0,1100.0,2008.0,51.70804434782608,1
2296,R THALLASSERY AT PATHIPPALAM,KERALA,27.0,7.3,6.1,45.0,0.7,0.2,150.0,1050.0,2008.0,29.26951449275362,2
2297,R ANCHARAKANDY AT MERUVAMBA,KERALA,27.0,7.6,6.3,39.0,0.5,0.2,1040.0,2588.0,2008.0,49.53389362318841,2
2298,R KUPPAM AT RAYAROM,KERALA,25.0,7.7,6.6,31.0,0.3,0.15,490.0,1300.0,2008.0,40.04482,2
2299,R RAMAPURAM AT RAMAPURAM BRIDGE,KERALA,28.0,5.4,5.9,595.0,0.8,0.1,570.0,1375.0,2008.0,45.286933333333344,2
2300,R PERUVAMBA AT CHANDAPPURA,KERALA,28.0,7.4,6.1,30.0,0.9,0.3,690.0,1050.0,2008.0,42.50046086956521,2
2301,R KAVVAI AT KUTTIYOL PALAM,KERALA,28.0,6.6,5.9,37.0,0.7,0.1,540.0,1725.0,2008.0,37.91992985507248,2
2302,R NEELASWARAM AT NAMBIARKAL DAM,KERALA,28.0,6.5,6.5,1135.0,0.7,0.25,850.0,1850.0,2008.0,55.9534768115942,1
2303,R PULLUR AT PULLUR BR.,KERALA,27.0,7.2,5.9,39.0,0.8,0.55,440.0,1500.0,2008.0,33.70874811594204,2
2304,R MOGRAL AT MOGRAL BR.,KERALA,29.0,6.3,6.5,925.0,1.1,0.3,830.0,1550.0,2008.0,59.90771739130436,1
2305,R SHRIYA AT ANGADIMOGARU,KERALA,27.0,7.6,6.6,50.0,0.6,0.25,1660.0,3000.0,2008.0,69.42762028985507,1
2306,R UPPALA AT  UPPALA BR.,KERALA,27.0,7.3,6.5,64.0,1.4,0.5,1280.0,2850.0,2008.0,67.81589449275363,1
2307,R MANJESWAR AT BAJRAKKARA BR.,KERALA,27.0,7.5,7.0,74.0,0.8,0.1,1400.0,2800.0,2008.0,72.82198724637682,1
2326,R KORAYAR AT KANJIKODE,KERALA,26.0,4.4,7.3,428.0,0.4,0.15,285.0,1090.0,2008.0,64.4685295652174,1
2331,R BHARATHAPUZHA AT KUTTIPPURAM,KERALA,27.0,6.8,7.0,169.0,0.4,0.25,255.0,560.0,2008.0,46.888795942028985,2
2337,R KADAMBAYAR AT BRAHMAPURAM,KERALA,29.0,1.7,6.2,181.0,3.0,0.45,672.0,2208.0,2008.0,90.15419739130436,0
2338,R KADAMBAYAR AT MANCKAKADAVU,KERALA,29.0,3.0,6.1,80.0,2.0,0.13,268.0,1240.0,2008.0,64.11350028985508,1
1448,"NAGAVALLI AT THOTAPALLI REGULATOR, A.P.",ANDHRA PRADESH,28.0,6.9,7.8,469.0,0.89,0.86,152.0,5874.0,2008.0,63.65866231884058,1
1455,"RUSHIKULYA AT GANJAM U/S, ORISSA",ODISHA,32.0,7.7,8.1,266.0,1.83,1.01,1950.0,3175.0,2008.0,112.45260666666668,0
1456,"RUSHIKULYA AT GANJAM D/S, ORISSA",ODISHA,32.0,6.8,7.8,16468.0,1.65,2.0,440.0,775.0,2008.0,79.75470927536233,0
1642,"NAGAVALLI AT JAYKAYPUR D/S, ORISSA",ODISHA,28.0,7.5,8.2,233.0,2.5,0.89,2600.0,4300.0,2008.0,135.67374057971014,0
1643,"NAGAVALLI AT RAYAGADA D/S, ORISSA",ODISHA,26.0,7.6,8.1,233.0,1.35,1.43,2025.0,3200.0,2008.0,110.3863936231884,0
1685,"ARASALAR RIVER KARAIKAL REGION, PONDICHERRY",PONDICHERRY,26.0,7.0,7.6,593.0,0.25,1.95,233.0,465.0,2008.0,54.786868695652174,1
1159,"TAMBIRAPARANI AT BDG.NR. MADURA COATS LTD.PAPAVINASAM,TAMILNADU",TAMILNADU,25.0,7.6,6.6,118.0,1.15,0.15,70.0,180.0,2008.0,38.54084695652173,2
1160,"TAMBIRAPARANI AT CHERANMADEVI,CAUSE WAY,TAMILNADU",TAMILNADU,27.0,6.8,6.6,179.0,1.88,0.2,118.0,253.0,2008.0,49.94724927536232,2
1161,"TAMBIRAPARANI AT TIRUNELVELI,COLLECTORATE,TAMILNADU.",TAMILNADU,28.0,6.8,6.7,172.0,2.14,0.19,263.0,402.0,2008.0,57.219415942029,1
1162,"TAMBIRAPARANI AT MURAPPANADU, TAMILNADU",TAMILNADU,28.0,6.9,7.1,260.0,1.78,0.13,110.0,200.0,2008.0,57.08266898550723,1
1328,"TAMBIRAPARANI AT PAPPANKULAM,TAMILNADU",TAMILNADU,27.0,7.3,6.6,94.0,1.27,0.17,73.0,150.0,2008.0,41.10295449275362,2
1329,"TAMBIRAPARANI AT RAIL BDG. NR. AMBASAMUDAM, TAMILNADU",TAMILNADU,26.0,7.4,6.7,88.0,1.03,0.15,89.0,173.0,2008.0,40.58854086956522,2
1330,"TAMBIRAPARANI AT ARUMUGANERI, TAMILNADU",TAMILNADU,28.0,7.2,7.2,439.0,2.28,0.14,236.0,415.0,2008.0,64.67378144927537,1
1450,"PALAR AT VANIYAMBADI WATER SUPPLY HEAD WORK, TAMILNADU",TAMILNADU,27.0,6.8,7.6,749.0,2.25,0.36,424.0,699.0,2008.0,77.58610260869565,0
1444,"KALI AT D/S WEST COAST PAPER MILL, KARNATAKA",KARNATAKA,26.0,6.9,7.3,252.0,4.33,1.0,322.0,858.0,2008.0,88.05058898550725,0
1894,KUMARADHARA NAN U/S OF UPPINAGADY TOWN BEFORE CONFLUENCE WITH RIVER NETHRAVATHI,KARNATAKA,29.0,7.0,7.3,46.0,1.0,0.52,49.0,707.0,2008.0,51.92802202898552,1
1892,NETRAVATHI U/S OF DHARMASTALA AT WATER SUPPLY INTAKE POINT,KARNATAKA,31.0,7.0,7.3,40.0,1.0,0.52,12.0,81.0,2008.0,50.97128202898551,0
2352,"RIVER VAMSHADHARA, KALINGAPATNAM,VIZIANAGARAM",ANDHRA PRADESH,30.0,7.7,8.1,195.0,1.1,0.7,0.0,10.0,2008.0,62.14983333333333,1
1871,"RIVER MARKANDA AT PAONTA, DISTT. SIRMOUR, H.P.",HIMACHAL PRADESH,23.0,8.0,8.2,572.0,0.5,0.52,12.0,26.0,2008.0,57.463352463768096,1
1870,"RIVER SUKHANA AT PARWANOO, DISTT. SOLAN, H.P.",HIMACHAL PRADESH,23.0,4.9,7.8,704.0,3.5,0.52,57.0,375.0,2008.0,93.08936811594202,0
1023,"GHAGGAR AT MUBARAKPUR REST HOUSE (PATIALA), PUNJAB",PUNJAB,20.0,5.9,7.2,703.0,5.4,2.05,1950.0,21000.0,2008.0,141.22115855072465,0
1024,"GHAGGAR AT 100M D/S CONF. WITH R. SARASWATI (PATIALA),PUNJAB",PUNJAB,21.0,5.3,7.4,1095.0,27.0,3.35,48000.0,217500.0,2008.0,1399.9462536231886,0
1295,"GHAGGAR NEAR BANKARPUR,DERA BASSI,PUNJAB",PUNJAB,21.0,5.7,7.3,732.0,10.7,2.4,5450.0,45500.0,2008.0,273.6195791304348,0
1473,"GHAGGAR AT RATANHERI, D/S OF PATIALA NADI (AFTER CONFL.), PUNJAB",PUNJAB,21.0,5.0,7.2,983.0,26.1,3.05,32250.0,135000.0,2008.0,1023.6682744927537,0
1698,"D/S CHHATBIR, PUNJAB",PUNJAB,20.0,5.0,7.3,748.0,7.4,2.65,12500.0,90000.0,2008.0,413.4014411594203,0
1699,"U/S DHAKANSU NALLAH, PUNJAB",PUNJAB,20.0,5.1,7.2,760.0,13.5,2.55,22000.0,122500.0,2008.0,682.2732608695653,0
1700,"D/S DHAKANSU NALLAH, PUNJAB",PUNJAB,21.0,4.5,7.2,856.0,23.8,3.45,34000.0,232500.0,2008.0,1065.8549026086955,0
1701,"D/S JHARMAL NADI, PUNJAB",PUNJAB,21.0,4.4,7.2,1184.0,18.1,3.75,17250.0,70000.0,2008.0,610.0595495652174,0
1702,"U/S JHARMAL NADI, PUNJAB",PUNJAB,20.0,4.5,7.4,1186.0,22.7,3.07,13000.0,78333.0,2008.0,561.604015942029,0
1703,"GHAGGER AT MOONAK, PUNJAB",PUNJAB,21.0,5.2,7.5,1036.0,28.5,3.55,28750.0,155000.0,2008.0,976.2752272463767,0
1704,"D/S SARDULGARH, PUNJAB",PUNJAB,21.0,5.5,7.6,973.0,27.8,3.33,130500.0,392500.0,2008.0,3271.2586530434783,0
1705,"U/S SARDULGARH, PUNJAB",PUNJAB,21.0,5.6,7.6,951.0,25.8,3.23,22500.0,712500.0,2008.0,936.6577927536232,0
1885,RIVER GHAGGAR AT D/S OF SURAJPUR,HARYANA,25.0,6.4,7.9,378.0,4.1,0.94,233.0,465.0,2008.0,96.80386376811592,0
1717,"KODRA DAM, MOUNT ABU, RAJASTHAN",RAJASTHAN,21.0,5.4,7.8,438.0,1.7,0.41,3.0,6.0,2008.0,73.40520666666666,1
1424,"IMPHAL AT MAHABALI, MANIPUR",MANIPUR,27.0,7.9,6.7,120.0,1.2,0.52,233.0,135.0,2008.0,42.90947942028985,2
1457,"IMPHAL AT KOIRENGEI, MANIPUR",MANIPUR,26.0,6.2,7.3,135.0,1.8,0.52,233.0,113.0,2008.0,66.81361768115941,1
1627,"KIYAMGI, MANIPUR",MANIPUR,27.0,8.2,7.6,176.0,1.9,0.52,233.0,135.0,2008.0,63.29893855072464,1
1628,"MINUTHONG(IMPHAL RIVER, MANIPUR",MANIPUR,28.0,6.6,7.4,112.0,1.2,0.52,233.0,91.0,2008.0,61.30416985507247,1
1458,"IRIL AT PORAMPET, MANIPUR",MANIPUR,26.0,7.9,7.8,196.0,0.8,0.52,233.0,73.0,2008.0,58.46775942028986,1
1624,"LILONG, MANIPUR",MANIPUR,29.0,9.0,8.0,269.0,1.8,0.52,233.0,155.0,2008.0,65.53390289855072,1
1925,KHUGA RIVER (CHURACHANDPUR DIST.),MANIPUR,28.0,6.7,8.0,698.0,1.8965,0.52,233.0,465.0,2008.0,77.61570089855073,0
1926,"KHUJAIROK RIVER, MOREH (CHANDEL DIST.)",MANIPUR,30.0,9.6,7.6,633.0,1.8965,0.52,233.0,30.0,2008.0,56.61017915942028,1
1625,"HUMP BRIDGE, MANIPUR",MANIPUR,27.0,3.2,6.8,389.0,26.0,0.52,233.0,633.0,2008.0,286.9549063768115,0
1626,"HEIRANGOITHONG, MANIPUR",MANIPUR,28.0,5.5,7.5,375.0,24.0,0.52,233.0,383.0,2008.0,270.2798263768116,0
1428,"KYRHUKHLA NEAR SUTNGA KHLIERIAT,JAINTIA HILLS DT.,MEGHALAYA",MEGHALAYA,19.0,5.0,3.2,630.0,7.0,2.5,27.0,33.0,2008.0,43.19624115942029,2
2050,TLAWNG UPSTREAM AIZAWL,MIZORAM,26.0,7.0,7.8,122.0,0.65,0.52,233.0,3.0,2008.0,61.43806202898551,1
2051,TLAWNG DOWNSTREAM AIZAWL,MIZORAM,26.0,7.2,7.8,130.0,0.93,0.1,233.0,3.0,2008.0,62.91028811594203,1
2052,TUIRIAL UPPER CATCHMENT,MIZORAM,25.0,6.6,8.0,151.0,0.98,0.52,233.0,6.0,2008.0,69.76260985507247,1
2053,TUIRIAL LOWER CATCHMENT,MIZORAM,25.0,6.7,7.9,188.0,1.03,0.52,233.0,8.0,2008.0,67.99670289855074,1
1403,"GUMTI AT U/S SOUTH TRIPURA,TRIPURA",TRIPURA,28.0,6.1,7.7,120.0,1.36,0.52,264.0,350.0,2008.0,71.07776463768117,1
1404,"GUMTI AT D/S SOUTH TRIPURA, TRIPURA",TRIPURA,29.0,5.4,7.3,141.0,2.67,0.08,285.0,510.0,2008.0,79.55330666666667,0
1726,"CHANDRAPUR, AGARTALA D/S OF HAORA RIVER, TRIPURA",TRIPURA,28.0,5.8,7.8,161.0,2.93,0.1,518.0,588.0,2008.0,93.7835255072464,0
1393,"DAMANGANGA AT D/S OF MADHUBAN, DAMAN",DAMAN & DIU,27.0,6.7,7.6,253.0,1.8965,2.8,233.0,465.0,2007.0,70.82308089855073,1
1150,"DAMANGANGA AT KACHIGAON U\S AT GIDC WIER,GUJARAT",GUJARAT,25.0,7.0,7.7,448.0,0.4,0.2,17.0,42.0,2007.0,52.76077536231884,1
1860,BALEHWAR KHADI AT N.H. NO. 8,GUJARAT,27.0,4.9,7.7,904.0,3.6,0.52,13950.0,32750.0,2007.0,406.440368115942,0
1861,RIVER PURNA ON BRIDGE AT SURATNANNAVSARI HIGHWAY,GUJARAT,28.0,6.4,8.0,477.0,2.4,0.52,12325.0,22825.0,2007.0,355.61972376811593,0
1862,RIVER KAVERI ON BRIDGE AT BILLIMORANANVALSAD ROAD,GUJARAT,29.0,6.7,7.9,14111.0,2.9,0.52,10725.0,21000.0,2007.0,324.1044428985508,0
1865,RIVER DHADHAR AT KOTHWADA,GUJARAT,28.0,5.7,7.6,868.0,4.2,0.4,5.0,57.0,2007.0,90.76887246376812,0
1148,"AMBIKA AT BILIMORA, GUJARAT",GUJARAT,30.0,6.2,8.0,899.0,3.1,0.52,10275.0,16500.0,2007.0,316.1746376811594,0
1149,"KOLAK AT PATALIA BDG., GUJARAT",GUJARAT,26.0,4.8,7.6,14426.0,10.4,0.1,32.0,148.0,2007.0,153.54773507246375,0
1438,"MINDHOLA AT STATE HIGHWAY BRIDGE SACHIN, GUJARAT",GUJARAT,27.0,4.2,7.8,589.0,4.0,0.52,23575.0,50250.0,2007.0,631.5779768115942,0
1399,"ZUARI AT D/S OF PT. WHERE KUMBARJRIA CANAL JOINS, GOA",GOA,30.0,6.8,7.5,2870.0,2.5,0.1,582.0,1114.0,2007.0,82.08439594202899,0
1475,ZUARI AT PANCHAWADI,GOA,29.0,6.5,6.9,1690.0,1.5,0.1,555.0,1331.0,2007.0,63.451096811594205,1
1476,"MANDOVI AT TONCA, MARCELA, GOA",GOA,29.0,6.5,7.1,3110.0,1.6,0.1,1243.0,2056.0,2007.0,83.4849968115942,0
1543,"RIVER KALNA AT CHANDELNAN PERNEM, GOA",GOA,27.0,7.2,7.2,70.0,1.6,0.1,1554.0,2887.0,2007.0,88.24050811594205,0
1544,"RIVER VALVANT AT SANKLI NAN BICHOLIM, GOA",GOA,28.0,7.2,6.8,60.0,2.1,0.1,5778.0,10403.0,2007.0,180.72422811594203,0
1545,"RIVER MADAI AT DABOS NAN  VALPOI, GOA",GOA,28.0,7.4,7.1,80.0,1.4,0.1,475.0,1010.0,2007.0,59.51529420289855,1
1546,"RIVER KHANDEPAR AT OPA NAN PONDA, GOA",GOA,28.0,7.2,6.9,80.0,1.3,0.1,1009.0,1938.0,2007.0,68.12582811594204,1
1547,"RIVER TALPONA AT CANACONA, GOA",GOA,29.0,7.4,7.0,66.0,2.0,0.1,700.0,1451.0,2007.0,68.15693420289855,1
1548,"RIVER ASSONORA AT ASSONORA, GOA",GOA,28.0,6.3,6.6,66.0,1.6,0.1,1427.0,3293.0,2007.0,79.43603072463767,0
1093,"ULHAS AT U/S OF NRC BUND AT MOHANE, MAHARASHTRA",MAHARASHTRA,26.0,6.4,7.3,103.0,4.0,0.24,126.0,753.0,2007.0,83.0642904347826,0
1094,"ULHAS AT U/S OF BADLAPUR, MAHARASHTRA",MAHARASHTRA,27.0,6.7,7.4,103.0,3.9,0.22,64.0,644.0,2007.0,81.07546289855071,0
1461,"BHATSA AT D/S OF PISE DAM NEAR PISE VILLAGE (ULHAS), MAHARASHTRA",MAHARASHTRA,28.0,6.6,7.5,97.0,3.7,0.25,16.0,169.0,2007.0,80.35880985507248,0
1092,"KALU AT ATALE VILLAGE, MAHARASHTRA",MAHARASHTRA,28.0,5.7,7.2,531.0,5.3,0.75,116.0,456.0,2007.0,96.06707913043476,0
1462,"PATALGANGA NEAR INTAKE OF MIDC W/W, MAHARASHTRA",MAHARASHTRA,25.0,6.4,7.1,113.0,3.9,0.47,60.0,400.0,2007.0,77.19817710144926,0
1151,"PATALGANGA AT SHILPHATA, MAHARASHTRA",MAHARASHTRA,25.0,6.6,7.2,88.0,3.9,0.45,228.0,1146.0,2007.0,81.84123652173913,0
1152,"KUNDALIKA AT ROHA CITY, MAHARASHTRA",MAHARASHTRA,22.0,6.2,7.3,117.0,4.0,0.5,169.0,638.0,2007.0,84.98297101449273,0
17,"PERIYAR NEAR ALWAYENANELOOR, KERALA",KERALA,28.0,5.5,6.6,1314.0,1.7,0.4,290.0,668.0,2007.0,58.77208637681159,1
18,"PERIYAR AT KALADY, KERALA",KERALA,27.0,7.5,6.8,32.0,0.8,0.3,200.0,738.0,2007.0,42.38897391304348,2
1338,"PERIYAR AT SEWAGE DISCHARGE POINT, KERALA",KERALA,28.0,6.7,6.8,42.0,1.0,0.4,230.0,804.0,2007.0,48.69872289855073,2
20,"CHALIYAR AT KOOLIMADU, KERALA",KERALA,28.0,6.9,6.7,73.0,0.5,0.2,688.0,1242.0,2007.0,51.77766231884058,1
21,"CHALIYAR AT CHUNGAPALLY, KERALA",KERALA,28.0,6.8,6.9,7920.0,0.5,0.2,391.0,813.0,2007.0,50.79900927536234,0
42,"KALLADA AT PERUMTHOTTAMKADAVU, PUNALOOR, KERALA",KERALA,29.0,7.4,7.2,49.0,1.1,0.3,327.0,641.0,2007.0,55.258760869565215,1
43,"MUVATTAPUZHA AT VETTIKKATTUMUKKU, KERALA",KERALA,28.0,7.2,6.8,58.0,1.5,0.3,173.0,556.0,2007.0,49.3976147826087,2
1154,"CHALAKUDY AT PULICKALKANANDAVU, KERALA",KERALA,29.0,6.8,6.6,115.0,2.0,0.5,148.0,635.0,2007.0,51.77524927536232,1
1155,"KARAMANA AT MOONNATTUMUKKU, KERALA",KERALA,28.0,0.8,6.8,2156.0,7.4,1.0,14825.0,20733.0,2007.0,461.20021333333335,0
1156,"PAMBA AT CHENGANNUR, KERALA",KERALA,26.0,7.1,6.1,34.0,0.6,0.5,1300.0,1975.0,2007.0,54.995368405797095,1
1341,"PAMBA AT THAKAZHY, KERALA",KERALA,26.0,5.9,6.2,52.0,0.5,0.6,1100.0,1775.0,2007.0,57.17010521739132,1
1565,"PAMBA DOWN, KERALA",KERALA,26.0,5.1,6.2,55.0,1.1,0.4,1275.0,2000.0,2007.0,70.22579420289856,1
1339,"MEENACHIL AT KIDANGOOR, KERALA",KERALA,26.0,6.7,6.2,43.0,0.7,0.4,1325.0,2100.0,2007.0,60.111962898550736,1
1340,"MANIMALA  AT KALLOOPARA, KERALA",KERALA,26.0,5.8,6.2,34.0,0.6,0.3,975.0,1625.0,2007.0,55.70413217391307,1
1384,"MANIMALA AT THONDRA, KERALA",KERALA,26.0,6.4,6.2,39.0,0.7,0.4,1375.0,1900.0,2007.0,62.61534376811594,1
1342,"ACHENKOIL AT THUMPAMON, KERALA",KERALA,26.0,6.6,6.3,41.0,0.6,0.3,1033.0,1442.0,2007.0,54.834516521739125,1
1443,"ACHENKOIL AT CHENNITHULA, KERALA",KERALA,26.0,5.4,6.2,47.0,0.7,0.5,1250.0,1825.0,2007.0,64.65990666666667,1
1442,"VAMANAPURAM, KERALA",KERALA,28.0,6.7,6.7,80.0,1.3,0.5,1655.0,3050.0,2007.0,81.62423623188407,0
1563,"AMARAVILA, KERALA",KERALA,27.0,6.4,7.0,112.0,1.4,0.7,3850.0,5725.0,2007.0,138.28760376811596,0
1564,"AYUR, KERALA",KERALA,29.0,6.3,7.1,83.0,1.0,0.4,643.0,1080.0,2007.0,65.02811072463768,1
1566,"THIRURANGADY, KERALA",KERALA,28.0,6.2,6.5,95.0,0.8,1.2,1075.0,2550.0,2007.0,63.28350434782608,1
1567,"KUTTIYADY ESTATE, KERALA",KERALA,28.0,6.9,6.4,41.0,0.5,0.2,83.0,285.0,2007.0,32.98158231884058,2
1568,"VALAYAM, KERALA",KERALA,27.0,6.8,6.5,51.0,0.5,0.2,98.0,435.0,2007.0,35.56536927536233,2
1569,"THALIPARAMBA, KERALA",KERALA,28.0,6.6,6.9,11654.0,0.7,0.3,338.0,963.0,2007.0,53.22569652173913,1
1570,"HOSDURG, KERALA",KERALA,28.0,7.0,7.2,11962.0,0.3,0.3,68.0,550.0,2007.0,46.978448695652176,2
1571,"KAKKADAVU,  KERALA",KERALA,28.0,7.5,6.9,52.0,0.5,0.2,138.0,685.0,2007.0,40.08098057971015,2
1572,"PADIYATHADKA, KERALA",KERALA,28.0,7.4,6.8,68.0,0.3,0.2,160.0,725.0,2007.0,37.554187536231886,2
1573,"IRUMPANAM, KERALA",KERALA,29.0,2.8,6.6,1239.0,2.3,0.6,263.0,645.0,2007.0,76.47624086956525,0
1448,"NAGAVALLI AT THOTAPALLI REGULATOR, A.P.",ANDHRA PRADESH,28.0,6.2,7.6,380.0,0.5,0.5,1318.0,24583.0,2007.0,89.92763101449275,0
1455,"RUSHIKULYA AT GANJAM U/S, ORISSA",ODISHA,30.0,7.9,7.9,382.0,2.1,0.21,993.0,2700.0,2007.0,89.09232608695653,0
1642,"NAGAVALLI AT JAYKAYPUR D/S, ORISSA",ODISHA,30.0,7.2,7.7,244.0,1.2,0.51,980.0,1793.0,2007.0,80.5367347826087,0
1643,"NAGAVALLI AT RAYAGADA D/S, ORISSA",ODISHA,32.0,6.7,7.6,231.0,1.5,0.56,1460.0,3133.0,2007.0,94.76717623188408,0
