STATION CODE,LOCATIONS,STATE,Temp,DO,PH,Conductivity,BOD,NI,Fec_col,Tot_col,year,WQI,WQI clf
1871,"RIVER MARKANDA AT PAONTA, DISTT. SIRMOUR, H.P.",HIMACHAL PRADESH,20.3,7.1,7.5,293.0,1.3,0.0,9.0,19.0,2013.0,56.53666173913044,1
2624,MARKANDA U/S KALA AMB,HIMACHAL PRADESH,20.7,7.1,7.5,316.0,1.4,0.0,13.0,22.0,2013.0,57.51598173913044,1
2625,MARKANDA D/S KALA AMB/ BOUNDARY OF HARYANA,HIMACHAL PRADESH,20.8,6.6,7.5,274.0,1.6,0.0,14.0,24.0,2013.0,61.70511652173913,1
1870,"RIVER SUKHANA AT PARWANOO, DISTT. SOLAN, H.P.",HIMACHAL PRADESH,20.6,4.9,7.4,407.0,16.3,0.0,51.0,120.0,2013.0,199.1400747826087,0
2947,"RIVER JAWAI AT JAWAI DAM, SIROHI, RAJASTHAN",RAJASTHAN,28.0,4.9,8.3,603.0,1.0,0.0,4.0,5.0,2013.0,78.3075947826087,0
1717,"KODRA DAM, MOUNT ABU, RAJASTHAN",RAJASTHAN,23.4,5.5,7.4,138.0,0.8,0.0,4.0,6.0,2013.0,57.92459304347828,1
2948,"RIVER BANDI AT HEMAWAS DAM, PALI, RAJASTHAN",RAJASTHAN,25.3,5.5,8.1,625.0,1.1,0.0,4.0,6.0,2013.0,72.83933304347826,1
1719,"GAGGAR RIVER D/S HANUMANGARH NEAR 2 KNJ NAI ABADI, MAKKASR, RAJASTHAN",RAJASTHAN,31.1,5.0,7.3,305.0,1.7,0.0,4.0,12.0,2013.0,66.59888782608695,1
2949,"RIVER LUNI AT RANAKPUR DAM, RANAKPUR, PALI, RAJASTHAN",RAJASTHAN,26.3,5.6,8.1,552.0,1.1,0.0,4.0,6.0,2013.0,72.34218608695653,1
3305,"RIVER BANJAR AT MALANJKHAND NEAR W/S INTAKE POINT, JABALPUR",MADHYA PRADESH,22.0,7.3,7.3,402.0,2.1,0.0,4.0,32.0,2013.0,59.10042782608696,1
3383,"BUGI RIVER AT MIBANPARA, SOUTH GARO HILLS",MEGHALAYA,24.4,7.2,7.3,99.0,2.2,1.0,26.0,57.0,2013.0,61.001088115942025,1
3384,"BUGI RIVER AT DALU, SOUTH GARO HILLS",MEGHALAYA,23.7,7.2,7.4,102.0,2.2,1.0,25.0,56.0,2013.0,62.715428115942046,1
3380,"DAMRING RIVER (KRISHNEI RIVER) AT RESUBELPARA, EAST GARO HILLS",MEGHALAYA,24.6,7.6,7.2,72.0,1.8,2.56,24.0,57.0,2013.0,53.92036028985508,1
1632,"GANOL RIVER TURA, MEGHALAYA",MEGHALAYA,23.1,7.1,7.5,131.0,2.2,3.2,239.0,413.0,2013.0,69.98736840579711,1
1428,"KYRHUKHLA NEAR SUTNGA KHLIERIAT,JAINTIA HILLS DT.,MEGHALAYA",MEGHALAYA,21.7,5.2,2.9,682.0,7.8,1.5,16.0,30.0,2013.0,43.76601391304346,2
3369,"KYNSHI RIVER AT SOHIONG, WEST KHASI HILLS",MEGHALAYA,18.2,7.3,7.1,47.0,1.3,2.0,15.0,48.0,2013.0,48.93401449275361,2
3370,"KYNSHI RIVER AT NANGKHNUM, WEST KHASI HILLS",MEGHALAYA,18.8,7.6,7.2,52.0,1.2,2.0,16.0,36.0,2013.0,48.36211362318841,2
3371,"KYNSHI RIVER AT RANIKOR, WEST KHASI HILLS",MEGHALAYA,23.8,8.0,6.9,64.0,1.8,3.38,23.0,49.0,2013.0,46.85204579710145,2
3372,RILANG RIVER,MEGHALAYA,17.8,7.9,7.3,46.0,1.4,1.0,12.0,29.0,2013.0,50.224659420289846,0
3373,WAH BLEI,MEGHALAYA,18.7,7.4,7.2,53.0,1.9,3.0,14.0,32.0,2013.0,55.585160869565215,1
3374,WAH BLEI,MEGHALAYA,18.8,7.7,7.2,55.0,1.6,3.0,15.0,63.0,2013.0,51.51566,1
3376,LUKHA RIVER,MEGHALAYA,22.6,7.1,6.5,237.0,3.8,4.56,674.0,1072.0,2013.0,76.72106173913043,0
3381,"MANDA RIVER (DUDHAI RIVER) AT JAMPA, EAST GARO HILLS",MEGHALAYA,25.2,7.8,7.2,50.0,1.6,1.77,20.0,41.0,2013.0,51.00465304347826,1
3382,"MANDA RIVER (DUDHAI RIVER) AT WAGAISI, EAST GARO HILLS",MEGHALAYA,24.8,7.3,7.3,71.0,2.0,2.66,21.0,47.0,2013.0,58.812234492753625,1
3377,"MYNTANG RIVER AT NARTIANG, JAYANTIA HILLS",MEGHALAYA,19.9,7.3,7.0,91.0,1.8,3.3,20.0,45.0,2013.0,51.88566782608696,1
3378,"MYNTANG RIVER AT MYNSO, JAYANTIA HILLS",MEGHALAYA,20.7,7.4,7.1,49.0,1.7,2.44,19.0,42.0,2013.0,52.12935420289854,1
1631,"MYNTDU RIVER JOWAI, MEGHALAYA",MEGHALAYA,20.6,6.5,7.1,99.0,2.7,3.56,1967.0,2722.0,2013.0,109.08499014492754,0
3379,"MYNTDU RIVER AT LESHKA, JAYANTIA HILLS",MEGHALAYA,21.5,7.5,5.7,50.0,1.5,2.21,10.0,23.0,2013.0,25.34586057971015,0
3367,"NONBAH RIVER AT NANGSTOIN MARKE, WEST KHASI HILLS",MEGHALAYA,17.7,5.8,6.9,68.0,3.1,4.9,197.0,463.0,2013.0,73.0471055072464,1
3368,"NONBAH RIVER AT NANGSTOIN MARKE, WEST KHASI HILLS",MEGHALAYA,17.9,6.9,7.2,44.0,1.4,2.66,14.0,33.0,2013.0,53.52566231884058,1
1633,"SIMSANG RIVER WILLIAMNAGAR, MEGHALAYA",MEGHALAYA,23.9,7.8,7.3,93.0,1.9,2.99,264.0,444.0,2013.0,61.02015971014493,1
3353,"UMIAM MAWPHLANG RIVER AT NONGKREM, EAST KHASI HILLS",MEGHALAYA,18.0,6.6,7.0,66.0,2.3,4.0,29.0,63.0,2013.0,59.95316985507247,1
3354,"UMIAM MAWPHLANG RIVER AT UMTYNGNGAR, EAST KHASI HILLS",MEGHALAYA,18.4,7.6,7.1,53.0,1.7,3.0,23.0,53.0,2013.0,51.32010695652174,1
3355,"UMIAM MAWPHLANG RIVER AT MAWPHLANG, EAST KHASI HILLS",MEGHALAYA,18.8,7.8,7.0,47.0,1.4,2.0,8.0,35.0,2013.0,45.52021971014493,2
3356,"UMIAM MAWPHLANG RIVER AT SHELLA, EAST KHASI HILLS",MEGHALAYA,24.8,7.7,7.4,128.0,1.6,3.32,25.0,56.0,2013.0,55.25816666666668,1
3350,UMKHEN AT WAHKDAIT,MEGHALAYA,19.3,7.1,7.0,54.0,1.8,2.58,20.0,43.0,2013.0,52.76054173913043,1
3351,UMKHEN AT KSEHPONGDENG,MEGHALAYA,20.6,7.4,7.0,69.0,1.6,3.3,17.0,87.0,2013.0,49.57228086956522,2
3352,"UMKHEN RIVER AT DIENGPASOH, EAST KHASI HILLS",MEGHALAYA,20.7,7.5,7.2,58.0,1.6,2.25,21.0,46.0,2013.0,52.52535391304348,1
3357,"UMNGOT RIVER AT SMIT, EAST KHASI HILLS",MEGHALAYA,17.6,7.2,6.9,55.0,1.7,3.04,26.0,56.0,2013.0,49.84422811594203,2
3358,"UMNGOT RIVER AT DAWKI, EAST KHASI HILLS",MEGHALAYA,22.7,7.9,7.1,55.0,1.2,3.55,23.0,50.0,2013.0,45.51075942028985,2
3363,"UMSHYRPI RIVER AT RISA COLONY, EAST KHASI HILLS",MEGHALAYA,17.9,6.9,6.9,52.0,2.2,3.48,1576.0,45.0,2013.0,90.01351565217392,0
3365,"UMSHYRPI RIVER AT UMSHYRPI BRIDGE, EAST KHASI HILLS",MEGHALAYA,19.4,4.5,7.1,196.0,15.5,11.0,48611.0,43333.0,2013.0,1272.6139292753624,0
1427,"UMTREW AT BYRNIHAT EAST, MEGHALAYA",MEGHALAYA,23.7,7.2,7.1,107.0,6.7,5.56,303.0,476.0,2013.0,104.077288115942,0
3366,"UMTREW RIVER AT UMRAN, RINAN BHOI",MEGHALAYA,22.7,7.5,7.0,82.0,2.1,3.02,45.0,122.0,2013.0,54.11594057971016,1
2050,TLAWNG UPSTREAM AIZAWL,MIZORAM,23.6,7.1,7.5,189.0,1.9,1.0,233.0,465.0,2013.0,66.98283507246377,1
2051,TLAWNG DOWNSTREAM AIZAWL,MIZORAM,23.8,7.0,7.6,197.0,1.8,1.0,233.0,465.0,2013.0,68.3164820289855,1
2052,TUIRIAL UPPER CATCHMENT,MIZORAM,23.5,7.2,7.9,158.0,1.9,0.95,233.0,465.0,2013.0,73.43346144927536,1
2053,TUIRIAL LOWER CATCHMENT,MIZORAM,23.5,6.5,7.8,161.0,1.8,0.99,233.0,465.0,2013.0,74.18490347826086,1
1403,"GUMTI AT U/S SOUTH TRIPURA,TRIPURA",TRIPURA,27.4,6.6,7.7,165.0,1.7,0.0,280.0,325.0,2013.0,71.98315652173913,1
1404,"GUMTI AT D/S SOUTH TRIPURA, TRIPURA",TRIPURA,21.9,6.7,7.8,167.0,4.8,1.0,440.0,520.0,2013.0,104.36794289855074,0
1726,"CHANDRAPUR, AGARTALA D/S OF HAORA RIVER, TRIPURA",TRIPURA,27.5,6.6,7.7,183.0,3.7,1.55,415.0,575.0,2013.0,92.8990831884058,0
1393,DAMANGANGA AT D/S OF MADHUBAN,DAMAN & DIU,31.0,7.1,7.8,151.0,8.0,0.08,233.0,465.0,2012.0,126.07908840579712,0
1150,DAMANGANGA AT KACHIGAON U\S AT GIDC WIER,GUJARAT,28.0,7.2,7.4,319.0,0.7,0.18,5.0,10.0,2012.0,48.94339478260871,2
1865,RIVER DHADAR AT KOTHADA,GUJARAT,27.0,6.2,8.4,894.0,9.0,0.38,140.0,350.0,2012.0,147.79253101449277,0
1434,AMLAKHADI AFTER CONFL. OF W. WATER FROM ANKLESHWAR,GUJARAT,30.0,2.2,8.0,1835.0,17.9,0.86,10478.0,25478.0,2012.0,473.1322692753623,0
1980,AMLAKHADI AT PUNGAM ANKLESHWAR DISTT BHARUCH,GUJARAT,31.0,2.0,7.7,3165.0,32.3,3.44,11498.0,15173.0,2012.0,617.2048231884058,0
1149,KOLAK AT PATALIA BDG,GUJARAT,29.0,2.4,7.6,1500.0,6.2,1.31,3.0,13.0,2012.0,124.53339536231884,0
1399,ZUARI AT D/S OF PT. WHERE KUMBARJRIA CANAL JOINS,GOA,31.0,5.9,7.2,52.0,2.1,0.08,233.0,90.0,2012.0,69.10505188405797,1
1475,ZUARI AT PANCHAWADI,GOA,30.0,6.1,6.8,408.0,1.3,0.17,1300.0,3808.0,2012.0,78.6040979710145,0
3181,RIVER ZUARI AT BORIM BRIDGE,GOA,30.0,5.5,6.9,143.0,1.3,0.09,4100.0,11113.0,2012.0,146.64667304347827,0
3182,RIVER ZUARI AT MARCAIM JETTY,GOA,29.0,5.4,7.2,60.0,1.5,0.08,428.0,2309.0,2012.0,70.99872666666667,1
1400,MANDOVI AT NEGHBOURHOOD OF PANAJI,GOA,29.0,5.8,7.2,34.0,5.3,0.17,855.0,3322.0,2012.0,112.37565884057972,0
1476,"MANDOVI AT TONCA, MARCELA",GOA,29.0,5.9,6.7,125.0,1.5,0.14,1638.0,5793.0,2012.0,87.44163188405798,0
3185,MANDOVI AT AMONA BRIDGE,GOA,28.0,6.4,6.7,175.0,1.3,0.1,772.0,3636.0,2012.0,63.659283768115934,1
3186,RIVER MANDOVI AT IFFI JETTY,GOA,30.0,6.2,7.7,39.0,1.3,0.06,1296.0,4517.0,2012.0,93.72138434782607,0
3187,MANDOVI NEAR HOTEL MARRIOT,GOA,30.0,6.1,7.8,39.0,1.5,0.06,1032.0,5840.0,2012.0,92.16553130434782,0
1543,KALNA AT CHANDELNAN PERNEM,GOA,27.0,7.3,6.9,61.0,0.7,0.09,1430.0,4388.0,2012.0,72.17136782608696,1
1548,RIVER ASSONORA AT ASSONORA,GOA,28.0,6.8,6.6,71.0,1.5,0.14,2495.0,3949.0,2012.0,99.89798927536232,0
2276,"BICHOLIM VARAZAN NAGAR, BICHOLIM",GOA,29.0,7.4,6.5,129.0,2.3,0.49,5868.0,16691.0,2012.0,179.75463420289856,0
2275,"RIVER CHAPORA NEAR ALORNA FORT ,PERNEM",GOA,28.0,7.0,6.8,503.0,1.6,0.66,965.0,2404.0,2012.0,69.29200869565217,1
3189,RIVER CHAPORA AT SIOLIM,GOA,29.0,6.3,7.5,31.0,1.6,0.06,1466.0,4267.0,2012.0,96.12413739130434,0
1546,KHANDEPAR AT OPA NAN PONDA,GOA,29.0,7.1,6.8,70.0,0.8,0.17,716.0,3567.0,2012.0,56.3334484057971,1
2270,"KHANDEPAR AT CODLI NR BDG, U/S OPA WATERWORKS,SANGUEM",GOA,30.0,7.3,6.8,69.0,1.2,0.12,457.0,2446.0,2012.0,52.93586782608696,1
2272,"RIVER KUSHAWATI NEAR BUND AT KEVONA,RIVON,SANGUEM",GOA,28.0,6.7,6.6,118.0,1.0,0.22,1104.0,3496.0,2012.0,65.13140289855073,1
1545,RIVER MADAI AT DABOS NAN  VALPOI,GOA,28.0,7.4,6.8,80.0,1.3,0.06,274.0,1404.0,2012.0,49.06230086956522,2
2274,RIVER MAPUSA ON CULVERT ON HIGHWAY MAPUSANANPANAJI,GOA,29.0,4.5,6.6,250.0,2.4,0.16,1572.0,5889.0,2012.0,98.99985594202896,0
2271,"SAL PAZORKHONI, CUNCOLIM (NEAR CULVERT MARGAONAN CANACONA NATIONAL HIGHWAY)",GOA,28.0,6.1,6.9,74.0,1.8,0.19,1074.0,3937.0,2012.0,79.72858463768117,0
2273,"RIVER SAL NEAR HOTEL LEELA MOBOR,CAVELOSSIM",GOA,30.0,5.9,7.3,44.0,1.6,0.14,962.0,2794.0,2012.0,83.12563188405797,0
3183,"SAL AT KHAREBAND, MARGAO",GOA,30.0,2.4,6.5,195.0,4.8,0.35,7980.0,14217.0,2012.0,272.0691153623189,0
3184,"SAL AT ORLIM BRIDGE, ORLIM",GOA,31.0,4.0,6.8,207.0,1.8,0.34,818.0,2280.0,2012.0,82.11893072463768,0
3190,RIVER SINQUERIM (CANDOLIM SIDE NEAR BRIDGE),GOA,29.0,5.4,7.6,40.0,1.6,0.07,290.0,1330.0,2012.0,75.55725333333332,0
3191,RIVER SINQUERIM NEAR NERUL TEMPLE,GOA,30.0,5.3,7.6,41.0,1.4,0.08,952.0,2517.0,2012.0,89.16059362318842,0
1547,RIVER TALPONA AT CANACONA,GOA,29.0,7.0,6.9,54.0,0.8,0.21,667.0,3059.0,2012.0,57.35672869565217,1
3188,RIVER TIRACOL AT TIRACOL,GOA,29.0,5.9,7.7,44.0,2.1,0.08,1200.0,831.0,2012.0,99.317011884058,0
1544,VALVANT AT SANKLI NAN BICHOLIM,GOA,29.0,7.1,6.5,60.0,1.7,0.13,2926.0,8163.0,2012.0,108.9377950724638,0
2651,"AMBA AT D/S OF WAKEN BRIDGENANU/S OF JS PETROCHEMICALS, WAKENPHATA, ROHA",MAHARASHTRA,29.0,6.9,7.7,99.0,3.3,0.56,53.0,123.0,2012.0,79.68866231884058,0
1461,BHATSA AT D/S OF PISE DAM NEAR PISE VILLAGE (ULHAS),MAHARASHTRA,30.0,6.6,7.9,123.0,3.2,0.52,44.0,104.0,2012.0,83.51654985507247,0
2653,"BHATSA AT D/S OF LIBERTY OIL MILLS, SATNEL, SHAHAPUR,THANE",MAHARASHTRA,27.0,6.6,7.7,220.0,3.6,0.65,25.0,77.0,2012.0,83.1950631884058,0
2654,"BHATSA AT U/S OF LIBERTY OIL MILLS, SATNEL, SHAHAPUR, THANE",MAHARASHTRA,27.0,6.8,7.7,219.0,3.4,0.63,23.0,75.0,2012.0,80.41544260869566,0
1092,KALU AT ATALE VILLAGE,MAHARASHTRA,27.0,4.8,7.2,5429.0,8.4,2.08,177.0,408.0,2012.0,130.3985750724638,0
2670,"KAN RIVER, NEAR SAKRI WATER WORKS, SAKRI, DHULE.",MAHARASHTRA,23.0,6.4,8.0,493.0,4.2,3.91,17.0,68.0,2012.0,94.91414376811592,0
1152,KUNDALIKA AT ROHA CITY,MAHARASHTRA,29.0,6.8,7.6,100.0,3.0,0.54,124.0,295.0,2012.0,77.38312260869564,0
2198,KUNDALIKA RIVER AT ARE KHURD ( SALINE ZONE ),MAHARASHTRA,29.0,6.7,7.5,316.0,4.6,0.6,47.0,132.0,2012.0,88.6079295652174,0
2672,"KUNDALIKA AT DHATAV AT JACKWELL (DRINKING WATER  PUMPING STATIONNANSWEET ZONE), ROHA",MAHARASHTRA,29.0,6.9,7.7,84.0,3.1,0.42,69.0,168.0,2012.0,78.2631556521739,0
2676,"MUCHKUNDI RIVER AT  WAKED, NEAR M/S ASAHI INDIA GLASS LTD., LANJA, RATNAGIRI.",MAHARASHTRA,28.0,6.9,7.9,312.0,2.7,1.58,4.0,107.0,2012.0,76.92142231884058,0
1151,PATALGANGA AT SHILPHATA,MAHARASHTRA,29.0,6.8,7.5,146.0,3.0,0.6,124.0,241.0,2012.0,75.65192260869566,0
1462,PATALGANGA NEAR INTAKE OF MIDC W/W,MAHARASHTRA,29.0,6.7,7.3,127.0,2.9,0.59,100.0,209.0,2012.0,71.23309623188406,1
2685,"PATALGANGA RIVER AT D/S OF KHARPADA BRIDGE, RAIGAD.",MAHARASHTRA,29.0,5.6,6.9,432.0,4.5,1.72,58.0,173.0,2012.0,82.99877942028985,0
2686,"PATALGANGA RIVER AT VYAL PUMP HOUSE , KHALAPUR, RAIGAD.",MAHARASHTRA,29.0,6.5,7.3,126.0,3.0,0.59,132.0,284.0,2012.0,73.80395014492753,1
2687,"PATALGANGA RIVER AT KHALAPUR PUMPING STATION, KHALAPUR, RAIGAD.",MAHARASHTRA,30.0,7.1,7.5,128.0,3.0,0.6,136.0,297.0,2012.0,74.48222173913045,1
2688,"PATALGANGA RIVER AT SAVROLI BRIDGE, KHALAPUR, RAIGAD.",MAHARASHTRA,30.0,6.4,7.3,129.0,3.1,0.6,68.0,191.0,2012.0,73.73713043478259,1
2689,"PATALGANGA AT GAGANGIRI MAHARAJ TEMPLE, KHOPOLI, RAIGAD.",MAHARASHTRA,29.0,6.9,7.7,129.0,2.9,0.55,135.0,268.0,2012.0,77.99746898550725,0
2696,"PEHLAR DAM ON PEHLAR INLET OF WATER WORKS, VASAI, THANE.",MAHARASHTRA,25.0,7.0,7.9,153.0,2.9,0.55,30.0,86.0,2012.0,78.63312202898551,0
2199,SAVITRI RIVER AT OVALE VILLAGE.,MAHARASHTRA,30.0,6.4,7.6,10165.0,3.7,2.14,5.0,139.0,2012.0,85.22888376811594,0
2701,"SAVITRI JACKWELL AT UPSA KENDRE, NANGALWADI, MAHAD, RAIGAD",MAHARASHTRA,30.0,6.9,7.7,307.0,2.8,3.6,4.0,123.0,2012.0,74.55789565217391,1
2702,"SAVITRI RIVER AT SHEDAV DOH, MAHAD,RAIGAD",MAHARASHTRA,31.0,6.3,7.7,322.0,3.5,1.1,4.0,116.0,2012.0,83.369244057971,0
2703,"SAVITRI RIVER AT DADLI BRIDGE, DADLI, MAHAD, RAIGADH",MAHARASHTRA,30.0,6.5,7.5,5835.0,3.4,1.72,4.0,126.0,2012.0,79.3327168115942,0
2704,"SAVITRI RIVER AT MUTHAVALI VILLAGE, MAHAD, RAIGADH",MAHARASHTRA,30.0,6.3,7.4,9245.0,4.7,2.0,4.0,134.0,2012.0,90.84906405797102,0
2706,"SURYA RIVER, U/S OF SURYA DAM, DHAMMI, VIKRAMGAD, THANE",MAHARASHTRA,28.0,6.5,8.1,1907.0,4.0,0.55,46.0,115.0,2012.0,94.9936168115942,0
2707,"SURYA AT MIDC PUMPING STN, GARVASHET, PALGHAR, THANE",MAHARASHTRA,28.0,7.0,8.0,1896.0,3.5,0.64,190.0,245.0,2012.0,89.6446020289855,0
2708,"SURYA RIVER AT INTAKE OF VASAINANVIRAR W/S SCHEME, MASVAN, PALGHAR, THANE",MAHARASHTRA,28.0,7.0,8.0,206.0,2.9,0.56,31.0,74.0,2012.0,80.40133536231883,0
2709,"TANSA RIVER NEAR ROAD BRIDGE, VILLAGE DAKEWALI, WADA, THANE",MAHARASHTRA,27.0,6.8,7.8,239.0,3.3,0.56,33.0,77.0,2012.0,81.48442927536232,0
1093,ULHAS AT U/S OF NRC BUND AT MOHANE,MAHARASHTRA,27.0,6.4,7.6,152.0,3.2,0.96,62.0,142.0,2012.0,79.73137043478259,0
1094,ULHAS AT U/S OF BADLAPUR,MAHARASHTRA,26.0,6.7,7.7,146.0,3.0,0.89,30.0,73.0,2012.0,77.52235623188406,0
2162,ULHAS ATJAMBHUL WATER WORKS,MAHARASHTRA,27.0,6.7,7.6,137.0,2.9,0.76,24.0,64.0,2012.0,74.75038289855074,1
2712,"VAITARNA NR RD BDG, GANDHARE VILLAGE, WADA, THANE.",MAHARASHTRA,28.0,6.6,7.8,228.0,3.5,0.57,30.0,79.0,2012.0,84.14981652173913,0
2164,VASHISTI AT U/S OF THREE M PAPER MILLS NEAR M/S MULTIFILMS PLASTIC PVT. LTD. AT KHERDI.,MAHARASHTRA,23.0,7.0,7.7,409.0,2.4,0.93,4.0,112.0,2012.0,70.26410869565217,1
2713,"VASHISHTI  AT D/S OF THREE M PAPER MILLS NR CHIPLUN WATER INTAKE JACKWELL,KHERDI,RATNAGIRI",MAHARASHTRA,22.0,6.8,7.6,263.0,2.9,0.81,4.0,123.0,2012.0,73.87346260869565,1
2714,"VASHISHTI RIVER AT U/S OF POPHALI NEAR KONPHANSAWANE BRIDGE, CHIPLUN, RATNAGIRI",MAHARASHTRA,23.0,6.9,7.5,338.0,2.3,3.93,4.0,108.0,2012.0,66.6994956521739,1
1342,ACHENKOIL AT THUMPAMON,KERALA,26.0,7.0,7.2,79.0,0.8,0.62,279.0,637.0,2012.0,53.507415362318845,1
1443,ACHENKOIL AT CHENNITHULA,KERALA,26.0,6.6,7.0,67.0,1.1,0.53,275.0,670.0,2012.0,54.5217431884058,1
3465,"ACHENKOIL AT KALLARAKADAVU, PATHANAMTHITTA",KERALA,26.0,6.6,7.3,59.0,0.7,0.57,281.0,541.0,2012.0,56.29577652173912,1
3466,"ACHENKOIL AT PANDALAM (NEAR AYYAPPA TEMPLE),PATHANAMTHITTA",KERALA,26.0,6.2,7.3,66.0,0.8,0.55,303.0,609.0,2012.0,59.60583768115941,1
2297,ANCHARAKANDY AT MERUVAMBA,KERALA,26.0,7.1,7.0,67.0,1.0,0.34,170.0,538.0,2012.0,48.86079507246378,2
2319,ANCHARAKANDY AT MERUVAMBA,KERALA,26.0,7.0,6.7,5341.0,1.1,0.37,158.0,528.0,2012.0,45.91524202898551,2
2286,R AYROOR AT AYROOR BRIDGE,KERALA,29.0,6.7,7.3,89.0,1.1,0.35,1163.0,2025.0,2012.0,79.15671623188406,0
2331,BHARATHAPUZHA AT KUTTIPPURAM,KERALA,28.0,6.2,7.3,136.0,1.0,0.46,296.0,676.0,2012.0,61.24183768115942,1
2332,R BHARATHAPUZHA AT PATTAMBI,KERALA,28.0,7.1,8.1,212.0,0.9,0.56,524.0,992.0,2012.0,75.05082840579709,0
1154,CHALAKUDY AT PULICKALKANANDAVU,KERALA,29.0,6.3,6.3,134.0,1.2,0.67,224.0,780.0,2012.0,43.62535072463768,2
20,CHALIYAR AT KOOLIMADU,KERALA,26.0,7.3,7.2,76.0,0.6,0.31,468.0,893.0,2012.0,54.49242115942029,1
21,CHALIYAR AT CHUNGAPALLY,KERALA,26.0,7.0,7.3,11041.0,0.9,0.29,256.0,503.0,2012.0,57.96639536231884,1
3464,"CHALIYAR AT NILAMBUR, MALAPPURAM",KERALA,28.0,6.8,7.1,75.0,0.8,0.5,693.0,1169.0,2012.0,61.98602927536233,1
1572,CHANDRAGIRI AT PADIYATHADKA,KERALA,29.0,7.4,7.2,61.0,0.7,0.11,54.0,255.0,2012.0,45.58160753623188,2
1573,CHITRAPUZHA AT IRUMPANAM,KERALA,28.0,1.7,6.6,769.0,3.4,1.11,556.0,1717.0,2012.0,98.16889739130434,0
2295,R CORAPUZHA AT KANAYANKODE,KERALA,26.0,6.1,7.5,14083.0,1.4,0.25,920.0,2686.0,2012.0,86.01370463768114,0
1564,"R ITHIKKARA AT AYUR, KERALA",KERALA,26.0,6.6,7.2,92.0,0.8,0.77,332.0,660.0,2012.0,56.62738318840581,1
2287,R ITHIKKARA AT ITHIKKARA,KERALA,25.0,6.6,7.2,1348.0,0.8,1.01,392.0,810.0,2012.0,58.2889431884058,1
1566,R KADALUNDI AT THIRURANGADY,KERALA,29.0,6.0,6.7,95.0,1.2,0.29,253.0,680.0,2012.0,52.58138492753623,1
2293,R KADALUNDI AT HAJIRAPPALLY,KERALA,29.0,6.6,6.8,78.0,1.0,0.2,275.0,626.0,2012.0,50.1212031884058,0
2337,KADAMBAYAR AT BRAHMAPURAM,KERALA,28.0,0.6,6.7,268.0,4.1,1.28,400.0,1308.0,2012.0,107.76404057971016,0
2338,KADAMBAYAR AT MANCKAKADAVU,KERALA,27.0,1.8,6.6,82.0,2.0,0.39,399.0,1410.0,2012.0,81.5279104347826,0
42,"KALLADA AT PERUMTHOTTAM KADAVU, PUNALOOR",KERALA,25.0,7.1,7.2,61.0,1.0,0.34,251.0,608.0,2012.0,54.13697507246378,1
3460,"KALPATHI PUZHA AT KALPATHI, PALAKKAD",KERALA,27.0,6.6,8.0,310.0,1.1,0.54,517.0,783.0,2012.0,77.30935652173913,0
3458,KARAPUZHA DAM AT WAYANAD,KERALA,27.0,7.0,7.1,97.0,0.8,0.35,45.0,77.0,2012.0,46.45125536231884,2
1571,R KARINGODE AT KAKKADAVU,KERALA,29.0,7.3,7.0,51.0,0.7,0.18,65.0,258.0,2012.0,42.83990782608696,2
1155,KARAMANA AT MOONNATTUMUKKU,KERALA,29.0,0.5,7.1,1717.0,21.2,4.41,3317.0,15833.0,2012.0,334.8805208695652,0
3471,"RIVER KARAMANA AT ARUVIKARA, THIRUVANANTHAPURAM",KERALA,29.0,7.0,7.4,55.0,0.9,0.32,800.0,1400.0,2012.0,69.50849536231884,1
2289,R KARUVANNURR AT KARUVANNUR BRIDGE,KERALA,29.0,6.1,6.8,67.0,1.1,0.58,80.0,394.0,2012.0,49.09042463768117,2
2301,R KAVVAI AT KUTTIYOL PALAM,KERALA,27.0,7.0,6.7,61.0,1.3,0.28,168.0,248.0,2012.0,46.67360202898551,2
2291,KEECHERI AT VADAKKANCHERY BDG,KERALA,30.0,5.2,6.9,81.0,1.5,0.37,71.0,465.0,2012.0,58.4938472463768,1
2326,R KORAYAR AT KANJIKODE,KERALA,27.0,6.1,8.0,510.0,1.1,0.72,784.0,1572.0,2012.0,85.85275130434782,0
1569,R KUPPAM AT THALIPARAMBA,KERALA,27.0,6.5,6.9,12150.0,1.8,0.52,711.0,1481.0,2012.0,71.9344168115942,1
2298,R KUPPAM AT RAYAROM,KERALA,25.0,7.9,7.2,50.0,1.1,0.3,319.0,845.0,2012.0,52.721626086956526,1
1567,R KUTTIYADE AT KUTTIYADY ESTATE,KERALA,25.0,7.5,6.9,34.0,0.9,0.14,110.0,256.0,2012.0,42.89808057971015,2
1568,"R MAHE AT VALAYAM, KERALA",KERALA,26.0,7.0,7.4,72.0,1.0,0.38,496.0,897.0,2012.0,63.57493536231884,1
2285,R MAMOM AT MAMOM BRIDGE,KERALA,29.0,7.3,7.3,99.0,0.9,0.23,1088.0,1788.0,2012.0,72.77923449275363,1
1340,MANIMALA  AT KALLOOPARA,KERALA,27.0,7.5,6.9,125.0,1.6,0.45,970.0,1400.0,2012.0,68.40607391304349,1
1384,MANIMALA AT THONDRA,KERALA,27.0,6.8,6.9,116.0,1.7,0.4,825.0,1260.0,2012.0,69.416135942029,1
3459,"MANIYANKODE PUZHA AT MANIYANKODE BRIDGE, WAYANAD",KERALA,27.0,5.8,7.3,107.0,0.9,0.88,232.0,343.0,2012.0,60.83286550724638,1
2307,R MANJESWAR AT BAJRAKKARA BR.,KERALA,28.0,7.1,7.2,85.0,0.8,0.31,67.0,184.0,2012.0,48.208895072463775,2
1339,MEENACHIL AT KIDANGOOR,KERALA,26.0,6.8,7.1,58.0,0.7,0.46,2010.0,3460.0,2012.0,90.702435942029,0
2304,R MOGRAL AT MOGRAL BR.,KERALA,29.0,5.7,7.3,13197.0,1.5,0.35,46.0,144.0,2012.0,65.29262579710145,1
43,MUVATTAPUZHA AT VETTIKKATTUMUKKU,KERALA,27.0,6.7,7.1,58.0,1.2,0.39,964.0,1739.0,2012.0,72.1066495652174,1
2302,NEELASWARAM AT NAMBIARKAL ,KERALA,28.0,7.0,6.9,3453.0,0.9,0.17,56.0,278.0,2012.0,44.87041536231884,2
1570,R NEELESWARAM AT HOSDURG,KERALA,29.0,6.5,7.0,14369.0,1.3,0.27,63.0,175.0,2012.0,55.09714347826086,1
1563,R NEYYAR AT AMARAVILA,KERALA,28.0,6.6,7.3,70.0,1.4,0.39,838.0,1875.0,2012.0,75.07809652173913,0
2284,R NEYYAR AT ARUVIPURAM,KERALA,29.0,7.0,7.3,60.0,0.8,0.18,631.0,1813.0,2012.0,63.229048695652175,1
2288,R PALLICKAL AT NELLIMUKAL,KERALA,26.0,6.3,7.2,97.0,0.8,0.56,357.0,880.0,2012.0,58.64968405797103,1
1156,PAMBA AT CHENGANNUR,KERALA,28.0,6.0,7.0,63.0,1.1,1.04,243.0,493.0,2012.0,56.71700492753624,1
1341,PAMBA AT THAKAZHY,KERALA,28.0,4.4,7.1,113.0,1.5,1.17,358.0,722.0,2012.0,72.3082895652174,1
1565,PAMBA DOWN,KERALA,28.0,4.5,7.2,79.0,1.0,1.04,279.0,537.0,2012.0,67.32890927536232,1
17,PERIYAR NEAR ALWAYENANELOOR,KERALA,28.0,5.1,6.9,1789.0,2.1,0.68,408.0,1946.0,2012.0,72.4693075362319,1
18,PERIYAR AT KALADY,KERALA,27.0,7.5,7.2,36.0,1.1,0.27,282.0,1134.0,2012.0,53.88549391304348,1
1338,PERIYAR AT SEWAGE DISCHARGE POINT,KERALA,28.0,6.8,7.0,59.0,1.3,0.32,648.0,2267.0,2012.0,63.89988927536232,1
2333,PERIYAR AT MUPPATHADAM,KERALA,28.0,6.8,6.9,114.0,1.4,0.23,388.0,1785.0,2012.0,57.19930927536233,1
2334,RIVER PERIYAR AT PATHALAM,KERALA,28.0,5.9,6.8,1108.0,2.2,0.62,386.0,1520.0,2012.0,67.03351188405797,1
2335,R PERIYAR AT KALAMASSERY,KERALA,28.0,4.9,6.7,88.0,2.2,0.28,480.0,2200.0,2012.0,72.07380811594203,1
2336,R PERIYAR AT PURAPPALLIKAVU,KERALA,28.0,6.8,6.9,1686.0,1.4,0.25,236.0,1223.0,2012.0,54.064495942029,1
3468,"PERIYAR AT KWA INTAKENAN ALUVA, ERNAKULAM",KERALA,28.0,7.1,6.9,45.0,1.2,0.29,451.0,1636.0,2012.0,55.33654840579711,1
2300,PERUVAMBA AT CHANDAPPURA,KERALA,26.0,6.9,6.6,56.0,1.1,0.3,177.0,542.0,2012.0,43.91295565217391,2
2303,R PULLUR AT PULLUR BR.,KERALA,28.0,6.5,6.3,49.0,1.0,0.22,87.0,323.0,2012.0,37.6966368115942,2
2290,R PUZHACKAL AT PUZHACKAL BRIDGE,KERALA,29.0,4.9,6.6,169.0,2.1,0.76,250.0,1241.0,2012.0,64.22892811594203,1
2305,R SHRIYA AT ANGADIMOGARU,KERALA,28.0,6.9,7.1,63.0,0.9,0.16,152.0,336.0,2012.0,50.21096898550724,0
2296,THALLASSERY AT PATHIPPALAM,KERALA,26.0,6.6,6.7,69.0,0.8,0.38,185.0,464.0,2012.0,44.60786318840581,2
2292,THIRUR AT THALAKKADATHUR BDG,KERALA,29.0,4.5,6.6,6381.0,2.1,0.34,196.0,435.0,2012.0,66.10327594202897,1
2306,R UPPALA AT  UPPALA BR.,KERALA,29.0,6.2,7.2,9326.0,1.3,0.22,61.0,141.0,2012.0,58.84579768115942,1
3473,"RIVER VALAPATTANAM AT PARASSINIKADAVU, KANNUR",KERALA,27.0,6.6,7.1,15158.0,1.1,0.26,126.0,810.0,2012.0,56.2861431884058,1
1442,VAMANAPURAM,KERALA,29.0,6.3,7.3,74.0,1.2,0.29,725.0,1813.0,2012.0,72.22996405797102,1
1448,NAGAVALLI AT THOTAPALLI REGULATOR,ANDHRA PRADESH,27.0,6.0,7.6,429.0,1.1,1.1,3.0,362.0,2012.0,61.88726492753622,1
2352,"RIVER VAMSHADHARA, KALINGAPATNAM,VIZIANAGARAM",ANDHRA PRADESH,27.0,6.0,7.8,308.0,1.1,1.47,3.0,343.0,2012.0,65.36891826086958,1
3080,"U/S OF KARAKAVAGU AT PALONCHA,  KHAMMAM",ANDHRA PRADESH,20.0,5.8,7.4,505.0,0.6,0.73,4.0,1517.0,2012.0,55.2039055072464,1
3081,"D/S OF KARAKAVAGU AT PALONCHA,  KHAMMAM",ANDHRA PRADESH,24.0,6.1,7.5,465.0,0.5,0.34,4.0,1458.0,2012.0,54.54702463768116,1
1444,KALI AT D/S WEST COAST PAPER MILL,KARNATAKA,28.0,6.4,7.1,183.0,2.3,0.62,209.0,398.0,2012.0,66.35923710144927,1
2780,"KALI AT U/S OF WCPM, DANDELI",KARNATAKA,27.0,7.1,7.4,135.0,1.9,0.72,419.0,995.0,2012.0,69.43154173913045,1
1894,KUMARADHARA NAN U/S OF UPPINAGADY TOWN B/C WITH RIVER NETHRAVATHI,KARNATAKA,32.0,6.7,7.2,103.0,1.0,0.52,11.0,70.0,2012.0,50.66788289855073,0
1892,NETRAVATHI U/S OF DHARMASTALA AT WATER SUPPLY INTAKE POINT,KARNATAKA,30.0,6.8,7.1,106.0,1.0,0.52,13.0,137.0,2012.0,48.51039594202899,2
2423,"BUDHABALANGA, D/S OF BARIPADA",ORISSA,22.0,7.8,7.9,213.0,1.5,0.35,7742.0,15083.0,2012.0,236.11749971014493,0
2424,BUDHABALANGA AT BALASORE D/S,ORISSA,22.0,7.7,8.1,312.0,2.0,0.75,12675.0,32017.0,2012.0,357.30688000000004,0
2425,"RIVER KERANDI(INTAKE WELL OF NALCO REFINARY, HAL, SUNABEDA)",ORISSA,24.0,6.9,7.6,99.0,1.6,1.39,3066.0,5395.0,2012.0,130.74214898550724,0
2422,"NAGAVALLI AT PENTA U/S, JAYKAYPUR TOWN",ORISSA,27.0,7.3,8.0,230.0,1.6,0.69,2346.0,4348.0,2012.0,119.57174782608696,0
1642,NAGAVALLI AT JAYKAYPUR D/S,ORISSA,26.0,6.8,8.1,264.0,2.6,1.16,2428.0,5142.0,2012.0,134.6109292753623,0
1643,NAGAVALLI AT RAYAGADA D/S,ORISSA,25.0,7.2,8.1,272.0,3.1,1.46,2196.0,4586.0,2012.0,131.89762144927536,0
1455,RUSHIKULYA AT GANJAM U/S,ORISSA,28.0,8.0,8.3,312.0,1.4,0.73,1618.0,4319.0,2012.0,103.56897246376812,0
2426,VANSADHARA AT MUNIGUDA (D/S OF M/S VEDANTAALUMINA PROJECT),ORISSA,26.0,7.0,8.0,199.0,1.8,1.11,1503.0,3573.0,2012.0,104.02370869565218,0
2427,VANSADHARA ATGUNUPUR (INTERSTATE BOUNDRY),ORISSA,28.0,7.2,8.1,201.0,1.6,0.36,1239.0,2324.0,2012.0,96.83639478260868,0
1685,ARASALAR RIVER KARAIKAL REGION,PONDICHERRY,31.0,6.8,7.8,505.0,2.1,0.02,233.0,465.0,2012.0,75.36686927536232,0
2444,CORINGA RIVER,PONDICHERRY,25.0,6.5,7.9,11170.0,3.0,0.3,233.0,465.0,2012.0,88.88984347826087,0
2442,GAUTAMINANGODAVARI RIVER,PONDICHERRY,25.0,6.9,7.4,4990.0,3.0,0.37,233.0,465.0,2012.0,76.93354898550724,0
2443,GAUTAMINANGODAVARI RIVER,PONDICHERRY,25.0,6.8,8.1,1516.0,1.8965,0.28,233.0,465.0,2012.0,79.02433394202897,0
1450,PALAR AT VANIYAMBADI WATER SUPPLY HEAD WORK,TAMILNADU,27.0,6.8,7.5,890.0,2.1,0.51,274.0,589.0,2012.0,71.23052260869568,1
1159,TAMBIRAPARANI AT BDG.NR. MADURA COATS LTD. PAPAVINASAM,TAMILNADU,23.0,7.3,7.6,160.0,1.9,0.06,32.0,89.0,2012.0,63.12268782608695,1
1160,"TAMBIRAPARANI AT CHERANMADEVI,CAUSE WAY",TAMILNADU,25.0,7.0,7.7,111.0,2.2,0.08,53.0,131.0,2012.0,69.42229536231883,1
1161,"TAMBIRAPARANI AT TIRUNELVELI,COLLECTORATE",TAMILNADU,26.0,6.7,7.7,139.0,3.1,0.22,123.0,300.0,2012.0,80.43800289855072,0
1162,TAMBIRAPARANI AT MURAPPANADU,TAMILNADU,29.0,7.2,7.2,288.0,2.1,0.14,33.0,91.0,2012.0,58.489621449275376,1
1328,TAMBIRAPARANI AT PAPPANKULAM,TAMILNADU,24.0,7.0,7.1,95.0,1.9,0.08,47.0,118.0,2012.0,56.211715362318834,1
1329,TAMBIRAPARANI AT RAIL BDG. ,TAMILNADU,24.0,7.0,7.5,84.0,1.7,0.06,32.0,87.0,2012.0,61.04238869565217,1
1330,TAMBIRAPARANI AT ARUMUGANERI,TAMILNADU,29.0,7.4,7.0,3101.0,15.6,0.15,76.0,174.0,2012.0,175.1459608695652,0
3025,"TAMBIRAPARANI AT ERAL, THOTHUKUDI",TAMILNADU,29.0,7.2,7.3,510.0,2.9,0.08,46.0,123.0,2012.0,67.64384144927536,1
3026,"TAMBIRAPARANI AT KALLIDAI KURICHI, TIRUNELVELI",TAMILNADU,24.0,7.1,7.4,88.0,1.8,0.07,34.0,90.0,2012.0,59.75733507246376,1
