STATION CODE,LOCATIONS,STATE,Temp,DO,PH,Conductivity,BOD,NI,Fec_col,Tot_col,year,WQI,WQI clf
1393,"DAMANGANGA AT D/S OF MADHUBAN, DAMAN",DAMAN & DIU,30.6,6.7,7.5,203.0,1.8965,0.1,11.0,27.0,2014.0,63.77832089855073,1
1399,"ZUARI AT D/S OF PT. WHERE KUMBARJRIA CANAL JOINS, GOA",GOA,29.8,5.7,7.2,189.0,2.0,0.2,4953.0,8391.0,2014.0,175.36350579710148,0
1475,ZUARI AT PANCHAWADI,GOA,29.5,6.3,6.9,179.0,1.7,0.1,3243.0,5330.0,2014.0,126.1358307246377,0
3181,RIVER ZUARI AT BORIM BRIDGE,GOA,29.7,5.8,6.9,64.0,3.8,0.5,5382.0,8443.0,2014.0,195.1056588405797,0
3182,RIVER ZUARI AT MARCAIM JETTY,GOA,29.5,5.8,7.3,83.0,1.9,0.4,3428.0,5500.0,2014.0,141.3932455072464,0
1400,"MANDOVI AT NEGHBOURHOOD OF PANAJI, GOA",GOA,30.0,5.5,7.4,81.0,1.5,0.1,2853.0,4049.0,2014.0,127.9717463768116,0
1476,"MANDOVI AT TONCA, MARCELA, GOA",GOA,29.2,6.1,6.7,308.0,1.4,0.3,3355.0,5672.0,2014.0,123.57109130434782,0
3185,RIVER MANDOVI AT AMONA BRIDGE,GOA,29.6,6.4,6.7,414.0,1.0,0.2,6073.0,9423.0,2014.0,179.49243710144927,0
3186,RIVER MANDOVI AT IFFI JETTY,GOA,30.0,6.4,7.6,305.0,2.2,0.1,3478.0,4990.0,2014.0,147.37916376811597,0
3187,RIVER MANDOVI NEAR HOTEL MARRIOT,GOA,30.1,6.3,7.6,77.0,2.3,0.1,2606.0,4301.0,2014.0,129.2725107246377,0
1543,"RIVER KALNA AT CHANDELNAN PERNEM, GOA",GOA,27.8,7.1,7.1,176.0,1.2,0.1,4573.0,7817.0,2014.0,151.2726150724638,0
1548,"RIVER ASSONORA AT ASSONORA, GOA",GOA,27.9,6.7,6.4,93.0,1.4,0.1,2147.0,3433.0,2014.0,88.21802289855074,0
2276,"RIVER BICHOLIM VARAZAN NAGAR , BICHOLIM",GOA,29.3,7.4,6.8,121.0,1.7,0.4,11633.0,18125.0,2014.0,307.3618142028986,0
2275,"RIVER CHAPORA NEAR ALORNA FORT ,PERNEM",GOA,29.2,6.9,7.0,620.0,1.1,0.1,3500.0,6300.0,2014.0,125.66422898550724,0
3189,RIVER CHAPORA AT SIOLIM,GOA,30.0,6.0,7.5,72.0,1.6,0.2,4995.0,9517.0,2014.0,176.73762492753625,0
1546,"RIVER KHANDEPAR AT OPA NAN PONDA, GOA",GOA,29.0,7.3,7.0,247.0,1.5,0.2,1095.0,2453.0,2014.0,73.21271449275363,1
2270,"RIVER KHANDEPAR AT CODLI NEAR BRIDGE ,U/S OPA WATERWORKS,SANGUEM",GOA,29.1,7.3,7.0,188.0,1.0,0.1,1286.0,3048.0,2014.0,73.11480115942028,1
2272,"RIVER KUSHAWATI NEAR BUND AT KEVONA,RIVON,SANGUEM",GOA,28.7,7.0,6.9,224.0,1.2,0.3,3896.0,6742.0,2014.0,133.11592869565217,0
1545,"RIVER MADAI AT DABOS NAN  VALPOI, GOA",GOA,28.7,7.3,6.7,144.0,1.5,0.1,1940.0,3052.0,2014.0,86.7774011594203,0
2274,RIVER MAPUSA ON CULVERT ON HIGHWAY MAPUSANANPANAJI,GOA,29.5,5.3,6.8,319.0,1.8,0.3,6458.0,10250.0,2014.0,202.28246695652172,0
2271,"RIVER SAL PAZORKHONI,CUNCOLIM(NEAR CULVERT MARGAONAN CANACONA NATIONAL HIGHWAY)",GOA,29.0,6.3,6.4,79.0,1.6,1.4,7592.0,12842.0,2014.0,214.45630405797107,0
2273,"RIVER SAL NEAR HOTEL LEELA MOBOR,CAVELOSSIM",GOA,29.4,5.4,7.6,39.0,1.4,0.1,3176.0,6367.0,2014.0,138.67865333333333,0
3183,"RIVER SAL AT KHAREBAND, MARGAO",GOA,28.3,2.2,6.5,322.0,4.7,1.2,11210.0,14920.0,2014.0,343.80462260869564,0
3184,"RIVER SAL AT ORLIM BRIDGE, ORLIM",GOA,30.1,5.2,7.1,192.0,2.6,0.3,5073.0,8925.0,2014.0,184.12521391304347,0
3190,RIVER SINQUERIM (CANDOLIM SIDE NEAR BRIDGE),GOA,30.3,5.6,7.5,282.0,1.8,0.1,3205.0,5082.0,2014.0,139.93293942028987,0
3191,RIVER SINQUERIM NEAR NERUL TEMPLE,GOA,30.5,5.5,7.4,275.0,1.5,0.1,4698.0,8625.0,2014.0,169.79564637681162,0
1547,"RIVER TALPONA AT CANACONA, GOA",GOA,29.1,7.3,6.7,55.0,1.4,0.1,2638.0,4003.0,2014.0,101.5076411594203,0
3188,RIVER TIRACOL AT TIRACOL,GOA,30.1,6.5,7.5,415.0,2.0,0.1,864.0,1538.0,2014.0,84.88703681159419,0
1544,"RIVER VALVANT AT SANKLI NAN BICHOLIM, GOA",GOA,29.2,7.2,6.3,100.0,1.5,0.1,7942.0,13575.0,2014.0,215.264068115942,0
2651,"AMBA RIVER AT D/S OF WAKEN BRIDGENANU/S OF JS PETROCHEMICALS, WAKENPHATA, ROHA",MAHARASHTRA,25.1,6.6,7.8,95.0,4.9,0.2,16.0,36.0,2014.0,96.1540431884058,0
1461,"BHATSA AT D/S OF PISE DAM NEAR PISE VILLAGE (ULHAS), MAHARASHTRA",MAHARASHTRA,29.6,6.9,7.9,99.0,5.0,0.4,15.0,34.0,2014.0,97.33218898550726,0
2653,"BHATSA RIVER AT D/S OF LIBERTY OIL MILLS, SATNEL, SHAHAPUR, THANE",MAHARASHTRA,27.4,6.8,7.7,85.0,5.2,0.3,11.0,23.0,2014.0,96.00684260869564,0
2654,"BHATSA RIVER AT U/S OF LIBERTY OIL MILLS, SATNEL, SHAHAPUR, THANE",MAHARASHTRA,27.8,6.7,7.8,80.0,4.9,0.3,12.0,29.0,2014.0,95.59064956521738,0
1092,"KALU AT ATALE VILLAGE, MAHARASHTRA",MAHARASHTRA,30.6,5.1,7.3,3937.0,10.3,1.8,31.0,83.0,2014.0,143.85316086956522,0
2670,"KAN RIVER, NEAR SAKRI WATER WORKS, SAKRI, DHULE.",MAHARASHTRA,25.0,5.6,7.9,468.0,3.6,1.9,66.0,164.0,2014.0,92.59439942028988,0
1152,"KUNDALIKA AT ROHA CITY, MAHARASHTRA",MAHARASHTRA,25.0,6.4,7.6,541.0,5.7,0.6,23.0,45.0,2014.0,101.02435043478262,0
2198,KUNDALIKA RIVER AT ARE KHURD ( SALINE ZONE ),MAHARASHTRA,25.0,5.5,7.4,6166.0,7.7,1.1,44.0,67.0,2014.0,121.34723971014492,0
2672,"KUNDALIKA RIVER AT DHATAV AT JACKWELL (DRINKING WATER  PUMPING STATIONNANSWEET ZONE), ROHA",MAHARASHTRA,25.1,6.7,7.6,83.0,4.8,0.2,28.0,76.0,2014.0,91.58711623188404,0
2168,MITHI RIVER,MAHARASHTRA,26.1,3.6,7.4,4424.0,31.3,2.2,276.0,474.0,2014.0,344.3488585507247,0
2676,"MUCHKUNDI RIVER AT  WAKED,RATNAGIRI, NEAR M/S ASAHI INDIA GLASS LTD., LANJA, RATNAGIRI.",MAHARASHTRA,21.4,7.2,7.7,226.0,3.1,0.8,233.0,130.0,2014.0,80.50872144927537,0
1151,"PATALGANGA AT SHILPHATA, MAHARASHTRA",MAHARASHTRA,27.4,5.9,7.4,268.0,6.4,0.4,37.0,68.0,2014.0,106.38671855072464,0
1462,"PATALGANGA NEAR INTAKE OF MIDC W/W, MAHARASHTRA",MAHARASHTRA,27.1,5.4,7.5,2413.0,7.4,1.5,59.0,116.0,2014.0,120.46908,0
2685,"PATALGANGA RIVER AT D/S OF KHARPADA BRIDGE, RAIGAD.",MAHARASHTRA,27.2,5.8,7.3,384.0,5.4,0.6,37.0,78.0,2014.0,96.32939217391306,0
2686,"PATALGANGA RIVER AT VYAL PUMP HOUSE , KHALAPUR, RAIGAD.",MAHARASHTRA,27.3,5.9,7.4,269.0,5.1,1.2,34.0,60.0,2014.0,94.89874521739132,0
2687,"PATALGANGA RIVER AT KHALAPUR PUMPING STATION, KHALAPUR, RAIGAD.",MAHARASHTRA,27.0,6.0,7.3,269.0,8.5,0.4,32.0,58.0,2014.0,122.6463515942029,0
2688,"PATALGANGA RIVER AT SAVROLI BRIDGE, KHALAPUR, RAIGAD.",MAHARASHTRA,27.2,6.1,7.3,196.0,6.1,0.5,30.0,63.0,2014.0,100.87223797101448,0
2689,"PATALGANGA RIVER AT GAGANGIRI MAHARAJ TEMPLE, KHOPOLI, RAIGAD.",MAHARASHTRA,27.0,5.9,7.4,269.0,6.4,0.4,19.0,47.0,2014.0,105.98451855072464,0
2696,"PEHLAR DAM ON PEHLAR RIVER INLET OF WATER WORKS, VASAI, THANE.",MAHARASHTRA,22.6,6.3,7.8,223.0,4.6,0.9,15.0,32.0,2014.0,95.02341739130436,0
2199,SAVITRI RIVER AT OVALE VILLAGE.,MAHARASHTRA,28.4,6.7,7.3,9293.0,3.5,1.8,233.0,0.0,2014.0,81.58642956521739,0
2701,"SAVITRI RIVER JACKWELL AT UPSA KENDRE, NANGALWADI, MAHAD, RAIGAD",MAHARASHTRA,28.0,6.8,7.2,170.0,3.1,1.4,233.0,0.0,2014.0,73.77774927536231,1
2702,"SAVITRI RIVER AT SHEDAV DOH, MAHAD,RAIGAD",MAHARASHTRA,27.6,6.8,7.3,4175.0,3.3,1.6,233.0,0.0,2014.0,78.18711594202898,0
2703,"SAVITRI RIVER AT DADLI BRIDGE, DADLI, MAHAD, RAIGADH",MAHARASHTRA,27.9,6.9,7.3,4282.0,3.3,1.6,233.0,0.0,2014.0,77.72956898550723,0
2704,"SAVITRI RIVER AT MUTHAVALI VILLAGE, MAHAD, RAIGADH",MAHARASHTRA,28.1,6.9,7.3,5551.0,3.4,1.7,233.0,0.0,2014.0,78.90488231884058,0
2706,"SURYA RIVER, U/S OF SURYA DAM, DHAMMI, VIKRAMGAD, THANE",MAHARASHTRA,27.1,6.8,7.9,5390.0,4.9,0.8,15.0,28.0,2014.0,98.13450927536236,0
2707,"SURYA RIVER AT MIDC PUMPING STATION, GARVASHET, PALGHAR, THANE",MAHARASHTRA,27.6,6.6,8.1,161.0,4.6,0.3,16.0,32.0,2014.0,98.73101652173912,0
2708,"SURYA RIVER AT INTAKE OF VASAINANVIRAR W/S SCHEME, MASVAN, PALGHAR, THANE",MAHARASHTRA,27.3,6.7,8.0,138.0,5.0,0.3,14.0,33.0,2014.0,100.00568956521738,0
2709,"TANSA RIVER NEAR ROAD BRIDGE, VILLAGE DAKEWALI, WADA, THANE",MAHARASHTRA,27.8,6.7,7.8,81.0,4.9,0.3,14.0,35.0,2014.0,95.6363895652174,0
1093,"ULHAS AT U/S OF NRC BUND AT MOHANE, MAHARASHTRA",MAHARASHTRA,28.0,5.9,7.7,194.0,5.5,0.6,22.0,51.0,2014.0,103.2982652173913,0
1094,"ULHAS AT U/S OF BADLAPUR, MAHARASHTRA",MAHARASHTRA,28.1,6.3,7.6,186.0,4.6,0.6,13.0,31.0,2014.0,91.46605739130436,0
2162,ULHAS RIVER ATJAMBHUL WATER WORKS.,MAHARASHTRA,28.6,6.6,7.6,207.0,4.7,0.7,12.0,31.0,2014.0,90.90144985507246,0
2712,"VAITARNA RIVER NEAR ROAD BRIDGE, GANDHARE VILLAGE, WADA, THANE.",MAHARASHTRA,26.9,6.8,7.7,85.0,5.0,0.4,15.0,34.0,2014.0,94.338195942029,0
2164,VASHISTI RIVER AT U/S OF THREE M PAPER MILLS NEAR M/S MULTIFILMS PLASTIC PVT. LTD. AT KHERDI.,MAHARASHTRA,23.0,7.1,7.4,176.0,2.7,0.9,233.0,30.0,2014.0,72.21894173913044,1
2713,"VASHISHTI RIVER AT D/S OF THREE M PAPER MILLS NEAR CHIPLUN WATER INTAKE JACKWELL, KHERDI, RATNAGIRI",MAHARASHTRA,23.0,7.0,7.4,178.0,2.7,0.9,233.0,40.0,2014.0,72.70266869565216,1
2714,"VASHISHTI RIVER AT U/S OF POPHALI NEAR KONPHANSAWANE BRIDGE, CHIPLUN, RATNAGIRI",MAHARASHTRA,23.0,7.2,7.2,180.0,2.7,1.0,233.0,70.0,2014.0,68.28646811594203,1
1342,"ACHENKOIL AT THUMPAMON, KERALA",KERALA,25.1,6.7,7.5,85.0,1.4,1.0,183.0,420.0,2014.0,63.34340289855072,1
1443,"ACHENKOIL AT CHENNITHULA, KERALA",KERALA,24.6,5.8,7.4,77.0,1.4,0.8,285.0,691.0,2014.0,68.22737884057972,1
3465,"ACHENKOIL AT KALLARAKADAVU, PATHANAMTHITTA",KERALA,25.7,6.6,7.5,75.0,1.4,0.7,183.0,448.0,2014.0,63.795649855072455,1
3466,"ACHENKOIL AT PANDALAM (NEAR AYYAPPA TEMPLE), PATHANAMTHITTA",KERALA,24.8,6.7,7.5,82.0,1.4,1.0,161.0,443.0,2014.0,62.86160289855073,1
2297,R ANCHARAKANDY AT MERUVAMBA,KERALA,27.3,6.7,6.9,56.0,0.9,0.2,82.0,172.0,2014.0,46.12089623188407,2
2319,R ANCHARAKANDY AT MERUVAMBA,KERALA,27.5,6.5,6.7,2240.0,1.2,0.2,136.0,304.0,2014.0,47.96959014492754,2
2286,R AYROOR AT AYROOR BRIDGE,KERALA,25.2,6.3,6.9,73.0,1.6,0.0,787.0,2008.0,2014.0,70.20793739130437,1
2331,R BHARATHAPUZHA AT KUTTIPPURAM,KERALA,29.9,7.0,7.4,130.0,0.7,0.1,301.0,590.0,2014.0,56.524442028985504,1
2332,R BHARATHAPUZHA AT PATTAMBI,KERALA,29.8,6.6,7.7,191.0,1.6,0.2,362.0,661.0,2014.0,73.0116631884058,1
1154,"CHALAKUDY AT PULICKALKANANDAVU, KERALA",KERALA,27.8,6.9,6.9,134.0,1.1,0.4,249.0,531.0,2014.0,50.73782898550725,0
20,"CHALIYAR AT KOOLIMADU, KERALA",KERALA,26.7,7.0,7.5,80.0,0.8,0.4,2573.0,3583.0,2014.0,110.0371020289855,0
21,"CHALIYAR AT CHUNGAPALLY, KERALA",KERALA,25.8,6.7,7.4,14526.0,0.8,0.6,1411.0,1969.0,2014.0,86.90906956521741,0
3464,"CHALIYAR AT NILAMBUR, MALAPPURAM",KERALA,26.4,7.2,7.4,82.0,0.7,0.5,840.0,1311.0,2014.0,67.66596144927537,1
1572,"CHANDRAGIRI AT PADIYATHADKA, KERALA",KERALA,29.8,7.5,7.2,67.0,1.1,0.1,76.0,590.0,2014.0,49.20144724637682,2
1573,"CHITRAPUZHA AT IRUMPANAM, KERALA",KERALA,28.6,3.0,6.6,965.0,1.7,1.2,247.0,530.0,2014.0,69.82928695652176,1
2295,R CORAPUZHA AT KANAYANKODE,KERALA,26.9,5.9,7.4,17990.0,0.7,0.5,1888.0,2803.0,2014.0,101.34889188405798,0
1564,"R ITHIKKARA AT AYUR, KERALA",KERALA,26.0,6.7,7.5,90.0,1.6,0.9,199.0,473.0,2014.0,65.4692295652174,1
2287,R ITHIKKARA AT ITHIKKARA,KERALA,23.6,6.1,7.4,4429.0,2.0,1.6,243.0,550.0,2014.0,72.18100463768116,1
1566,"R KADALUNDI AT THIRURANGADY, KERALA",KERALA,30.3,6.7,6.9,87.0,1.7,0.2,155.0,350.0,2014.0,54.86177623188407,1
2293,R KADALUNDI AT HAJIRAPPALLY,KERALA,30.7,6.9,6.8,85.0,1.6,0.2,82.0,206.0,2014.0,49.632982318840575,2
2337,R KADAMBAYAR AT BRAHMAPURAM,KERALA,28.7,2.1,6.8,101.0,1.6,0.8,431.0,694.0,2014.0,80.61453623188406,0
2338,R KADAMBAYAR AT MANCKAKADAVU,KERALA,28.2,2.5,6.9,83.0,1.9,0.3,353.0,656.0,2014.0,81.29100173913042,0
42,"KALLADA AT PERUMTHOTTAMKADAVU, PUNALOOR, KERALA",KERALA,24.8,7.2,7.6,75.0,1.4,1.0,188.0,426.0,2014.0,62.78358811594202,1
3460,"KALPATHI PUZHA AT KALPATHI, PALAKKAD",KERALA,29.2,6.1,7.6,281.0,1.2,0.7,384.0,718.0,2014.0,70.71350463768115,1
3458,KARAPUZHA DAM AT WAYANAD,KERALA,26.6,6.7,7.6,106.0,0.5,2.5,44.0,71.0,2014.0,54.13254289855072,1
1571,"R KARINGODE AT KAKKADAVU,  KERALA",KERALA,30.4,7.6,7.1,58.0,1.2,0.1,163.0,961.0,2014.0,49.87190028985507,2
1155,"KARAMANA AT MOONNATTUMUKKU, KERALA",KERALA,25.5,1.9,7.7,2941.0,26.9,2.8,10875.0,37375.0,2014.0,560.8819968115941,0
3471,"RIVER KARAMANA AT ARUVIKARA, THIRUVANANTHAPURAM",KERALA,25.1,7.4,7.0,35.0,0.1,0.0,165.0,409.0,2014.0,39.26764086956521,2
2289,R KARUVANNURR AT KARUVANNUR BRIDGE,KERALA,28.9,6.4,7.2,63.0,1.3,0.4,121.0,535.0,2014.0,57.27812376811594,1
2301,R KAVVAI AT KUTTIYOL PALAM,KERALA,28.8,5.4,6.7,65.0,1.1,0.3,60.0,144.0,2014.0,50.19398,0
2291,R KEECHERI AT VADAKKANCHERY BRIDGE,KERALA,29.3,5.6,7.3,90.0,1.6,0.4,268.0,705.0,2014.0,68.81045942028986,1
2326,R KORAYAR AT KANJIKODE,KERALA,29.5,7.1,8.0,728.0,1.2,0.4,374.0,697.0,2014.0,72.68655507246378,1
1569,"R KUPPAM AT THALIPARAMBA, KERALA",KERALA,28.4,5.9,6.8,13953.0,1.5,0.4,70.0,166.0,2014.0,56.35747855072464,1
2298,R KUPPAM AT RAYAROM,KERALA,26.9,7.4,6.9,57.0,1.1,0.3,70.0,159.0,2014.0,44.26678086956522,2
1567,"R KUTTIYADE AT KUTTIYADY ESTATE, KERALA",KERALA,25.8,7.2,7.2,41.0,0.7,0.2,441.0,658.0,2014.0,55.19058144927536,1
1568,"R MAHE AT VALAYAM, KERALA",KERALA,26.6,6.5,7.4,71.0,0.6,0.3,4192.0,7018.0,2014.0,145.45882347826088,0
2285,R MAMOM AT MAMOM BRIDGE,KERALA,25.3,6.8,7.1,81.0,0.8,0.0,389.0,1268.0,2014.0,55.23606260869565,1
1340,"MANIMALA  AT KALLOOPARA, KERALA",KERALA,28.2,6.8,6.9,68.0,1.7,0.1,449.0,660.0,2014.0,60.931175942029,1
1384,"MANIMALA AT THONDRA, KERALA",KERALA,28.5,6.6,7.0,70.0,1.4,0.1,550.0,822.0,2014.0,63.24192985507246,1
3459,"MANIYANKODE PUZHA AT MANIYANKODE BRIDGE, WAYANAD",KERALA,27.6,6.4,7.7,100.0,0.6,0.9,56.0,88.0,2014.0,58.2896904347826,1
2307,R MANJESWAR AT BAJRAKKARA BR.,KERALA,29.0,7.3,6.9,96.0,1.9,0.2,89.0,825.0,2014.0,52.39353449275364,1
1339,"MEENACHIL AT KIDANGOOR, KERALA",KERALA,27.5,6.8,6.6,49.0,0.5,0.4,1719.0,2950.0,2014.0,73.700195942029,1
43,"MUVATTAPUZHA AT VETTIKKATTUMUKKU, KERALA",KERALA,27.8,6.9,6.8,59.0,0.6,0.5,1916.0,3375.0,2014.0,82.03664231884059,0
2302,R NEELASWARAM AT NAMBIARKAL DAM,KERALA,30.2,7.1,6.8,14410.0,1.8,0.1,65.0,468.0,2014.0,53.263715072463775,1
1563,"R NEYYAR AT AMARAVILA, KERALA",KERALA,25.3,6.7,7.1,66.0,0.6,0.0,222.0,626.0,2014.0,50.11150956521739,0
2284,R NEYYAR AT ARUVIPURAM,KERALA,25.3,7.2,7.0,59.0,0.6,0.0,165.0,433.0,2014.0,44.6663747826087,2
2288,R PALLICKAL AT NELLIMUKAL,KERALA,25.8,6.0,7.6,120.0,1.3,1.1,212.0,523.0,2014.0,68.24400492753622,1
1156,"PAMBA AT CHENGANNUR, KERALA",KERALA,27.2,5.2,6.8,55.0,0.6,0.7,171.0,313.0,2014.0,50.9979672463768,0
1341,"PAMBA AT THAKAZHY, KERALA",KERALA,28.1,4.8,6.8,86.0,0.7,0.8,208.0,332.0,2014.0,54.647148405797104,1
1565,"PAMBA DOWN, KERALA",KERALA,28.3,3.9,6.9,62.0,0.5,0.7,155.0,284.0,2014.0,57.74445768115943,1
17,"PERIYAR NEAR ALWAYENANELOOR, KERALA",KERALA,28.1,5.0,6.9,3185.0,1.8,0.4,290.0,667.0,2014.0,67.68212115942029,1
18,"PERIYAR AT KALADY, KERALA",KERALA,27.7,7.0,7.0,36.0,1.1,0.2,276.0,541.0,2014.0,52.54821536231884,1
1338,"PERIYAR AT SEWAGE DISCHARGE POINT, KERALA",KERALA,28.0,6.3,6.9,64.0,1.2,0.3,381.0,815.0,2014.0,57.46289739130435,1
2333,RIVER PERIYAR AT MUPPATHADAM,KERALA,28.2,6.2,6.9,86.0,1.3,0.2,372.0,1007.0,2014.0,58.66643101449276,1
2334,RIVER PERIYAR AT PATHALAM,KERALA,28.0,5.7,6.8,2640.0,1.9,0.5,385.0,759.0,2014.0,65.47448579710145,1
2335,R PERIYAR AT KALAMASSERY,KERALA,28.1,5.7,6.9,53.0,3.1,0.4,574.0,1205.0,2014.0,81.52783246376812,0
2336,R PERIYAR AT PURAPPALLIKAVU,KERALA,28.1,6.6,7.1,2007.0,1.3,0.2,356.0,785.0,2014.0,60.234263188405805,1
3468,"PERIYAR AT KWA INTAKENAN ALUVA, ERNAKULAM",KERALA,28.1,6.6,7.0,46.0,1.3,0.3,228.0,472.0,2014.0,55.18011652173913,1
2300,R PERUVAMBA AT CHANDAPPURA,KERALA,27.3,6.5,6.5,43.0,0.9,0.4,87.0,188.0,2014.0,40.2720968115942,2
2303,R PULLUR AT PULLUR BR.,KERALA,28.3,6.7,6.3,54.0,0.9,0.1,136.0,610.0,2014.0,36.983282898550726,2
2290,R PUZHACKAL AT PUZHACKAL BRIDGE,KERALA,29.1,4.3,7.2,113.0,1.8,0.4,188.0,796.0,2014.0,73.35606985507246,1
2299,R RAMAPURAM AT RAMAPURAM BRIDGE,KERALA,28.7,4.6,6.7,12561.0,1.5,0.6,72.0,171.0,2014.0,60.63653565217392,1
2305,R SHRIYA AT ANGADIMOGARU,KERALA,28.5,7.7,6.9,61.0,1.6,0.0,88.0,554.0,2014.0,47.7023,2
2296,R THALLASSERY AT PATHIPPALAM,KERALA,26.6,5.8,6.5,61.0,1.0,0.4,70.0,151.0,2014.0,44.14502550724639,2
2292,R THIRUR AT THALAKKADATHUR BRIDGE,KERALA,31.0,4.5,6.9,1614.0,2.1,0.6,131.0,230.0,2014.0,68.80936260869566,1
3473,"RIVER VALAPATTANAM AT PARASSINIKADAVU, KANNUR",KERALA,28.8,6.6,7.0,14487.0,0.9,0.3,55.0,103.0,2014.0,50.91185652173913,0
1442,"VAMANAPURAM, KERALA",KERALA,25.3,6.9,7.5,54.0,0.6,0.0,319.0,1633.0,2014.0,58.45593565217391,1
1448,"NAGAVALLI AT THOTAPALLI REGULATOR, A.P.",ANDHRA PRADESH,25.9,5.5,7.6,569.0,1.3,0.9,18.0,141.0,2014.0,66.35491304347825,1
2352,"RIVER VAMSHADHARA, KALINGAPATNAM,VIZIANAGARAM",ANDHRA PRADESH,26.5,5.4,7.8,310.0,0.8,2.4,7.0,107.0,2014.0,65.73844,1
3080,"U/S OF KARAKAVAGU AT PALONCHA,  KHAMMAM, A.P.",ANDHRA PRADESH,18.9,7.1,7.8,516.0,0.7,0.5,2.0,1238.0,2014.0,56.6506684057971,1
3081,"D/S OF KARAKAVAGU AT PALONCHA,  KHAMMAM, A.P.",ANDHRA PRADESH,20.5,6.9,8.0,505.0,0.9,0.7,2.0,1563.0,2014.0,62.946188985507234,1
1444,"KALI AT D/S WEST COAST PAPER MILL, KARNATAKA",KARNATAKA,27.1,7.3,7.3,109.0,2.4,3.4,18.0,65.0,2014.0,62.37996115942028,1
2780,"KALI AT U/S OF WCPM, DANDELI, KARNATAKA",KARNATAKA,26.3,7.5,7.5,83.0,2.1,2.0,22.0,74.0,2014.0,62.16578057971014,1
1894,KUMARADHARA NAN U/S OF UPPINAGADY TOWN BEFORE CONFLUENCE WITH RIVER NETHRAVATHI,KARNATAKA,29.1,6.4,7.2,102.0,1.0,0.0,137.0,1223.0,2014.0,55.09233043478261,1
1892,NETRAVATHI U/S OF DHARMASTALA AT WATER SUPPLY INTAKE POINT,KARNATAKA,28.4,6.5,7.1,92.0,1.0,0.0,155.0,1342.0,2014.0,53.29702347826086,1
2423,"BUDHABALANGA, D/S OF BARIPADA TOWN",ODISHA,24.7,7.7,7.9,232.0,1.3,0.8,30790.0,40500.0,2014.0,749.8341066666666,0
2424,BUDHABALANGA AT BALASORE D/S,ODISHA,24.4,7.5,7.8,519.0,2.1,0.7,38700.0,53556.0,2014.0,933.877407246377,0
2425,"RIVER KERANDI(INTAKE WELL OF NALCO REFINARY, HAL, SUNABEDA)",ODISHA,22.7,7.3,7.2,103.0,0.7,1.7,4871.0,13810.0,2014.0,155.68357449275362,0
2422,"NAGAVALLI AT PENTA U/S, JAYKAYPUR TOWN",ODISHA,24.8,7.4,7.9,196.0,0.7,0.6,5323.0,15213.0,2014.0,177.55254086956523,0
1642,"NAGAVALLI AT JAYKAYPUR D/S, ODISHA",ODISHA,24.0,7.4,7.8,244.0,1.9,1.0,20880.0,12473.0,2014.0,529.7001342028985,0
1643,"NAGAVALLI AT RAYAGADA D/S, ODISHA",ODISHA,22.8,7.5,8.0,243.0,1.7,0.9,8780.0,30319.0,2014.0,267.4256139130435,0
1455,"RUSHIKULYA AT GANJAM U/S, ODISHA",ODISHA,26.8,7.2,8.0,296.0,1.5,0.7,1468.0,4314.0,2014.0,99.77196811594204,0
2426,VANSADHARA AT MUNIGUDA (D/S OF M/S VEDANTAALUMINA PROJECT),ODISHA,25.3,7.5,7.9,194.0,1.0,1.0,2906.0,8559.0,2014.0,124.8907672463768,0
2427,VANSADHARA ATGUNUPUR (INTERSTATE BOUNDRY),ODISHA,27.1,7.4,7.9,170.0,0.8,0.9,4948.0,16709.0,2014.0,170.50644086956524,0
1685,"ARASALAR RIVER KARAIKAL REGION, PONDICHERRY",PONDICHERRY,29.0,6.7,7.3,386.0,1.8965,0.2,233.0,465.0,2014.0,65.36007423188406,1
2445,MAHE RIVER,PONDICHERRY,32.0,6.0,7.1,13000.0,1.8965,0.4,233.0,465.0,2014.0,68.0526295942029,1
1450,"PALAR AT VANIYAMBADI WATER SUPPLY HEAD WORK, TAMILNADU",TAMILNADU,29.3,6.5,7.4,1063.0,2.0,0.6,177.0,374.0,2014.0,67.90948347826087,1
1159,"TAMBIRAPARANI AT BDG.NR. MADURA COATS LTD.PAPAVINASAM,TAMILNADU",TAMILNADU,22.8,6.8,6.6,63.0,2.9,0.1,11.0,36.0,2014.0,56.52739594202898,1
1160,"TAMBIRAPARANI AT CHERANMADEVI,CAUSE WAY,TAMILNADU",TAMILNADU,24.5,6.6,6.4,101.0,2.5,0.2,13.0,41.0,2014.0,50.5413631884058,0
1161,"TAMBIRAPARANI AT TIRUNELVELI,COLLECTORATE,TAMILNADU.",TAMILNADU,25.5,6.6,6.5,136.0,2.5,0.2,13.0,45.0,2014.0,52.2859431884058,1
1162,"TAMBIRAPARANI AT MURAPPANADU, TAMILNADU",TAMILNADU,29.0,6.7,6.9,226.0,2.2,0.2,12.0,38.0,2014.0,56.08941623188407,1
1328,"TAMBIRAPARANI AT PAPPANKULAM,TAMILNADU",TAMILNADU,23.8,6.7,6.3,72.0,2.7,0.2,9.0,32.0,2014.0,49.99791623188407,2
1329,"TAMBIRAPARANI AT RAIL BDG. NR. AMBASAMUDAM, TAMILNADU",TAMILNADU,22.8,6.7,6.4,61.0,4.6,0.1,10.0,34.0,2014.0,68.56190289855074,1
1330,"TAMBIRAPARANI AT ARUMUGANERI, TAMILNADU",TAMILNADU,29.0,6.6,7.2,1300.0,2.7,0.2,21.0,60.0,2014.0,66.6445231884058,1
3025,"TAMBIRAPARANI AT ERAL, THOTHUKUDI, TAMILNADU",TAMILNADU,29.0,6.7,7.0,461.0,2.5,0.1,17.0,51.0,2014.0,60.63514289855073,1
3026,"TAMBIRAPARANI AT KALLIDAI KURICHI, TIRUNELVELI, TAMILNADU",TAMILNADU,23.0,6.6,6.2,69.0,2.5,0.1,11.0,38.0,2014.0,47.00652985507247,2
3027,"TAMBIRAPARANI AT SRIVAIKUNTAM, D/S OF SK ANAICUT, TIRUNELVELI, TAMILNADU",TAMILNADU,29.0,6.8,6.9,241.0,2.5,0.1,14.0,48.0,2014.0,58.30269594202898,1
3028,"TAMBIRAPARANI AT VELLAKOIL, TIRUNELVELI, TAMILNADU",TAMILNADU,25.7,6.5,6.6,159.0,2.4,0.2,11.0,41.0,2014.0,53.577810144927525,1
3029,"TAMBIRAPARANI AT SIVALAPERI, CONFLUENCE POINT OF KUTTRALAM FALLS, D/S OF PALAYAMKOTTAI, TIRUNELVELI, TAMILNADU",TAMILNADU,25.7,6.6,6.7,170.0,2.5,0.2,10.0,34.0,2014.0,55.6967031884058,1
1885,RIVER GHAGGAR AT D/S OF SURAJPUR,HARYANA,27.0,6.7,7.3,198.0,1.8965,0.52,233.0,465.0,2014.0,65.35370089855073,1
1023,"GHAGGAR AT MUBARAKPUR REST HOUSE (PATIALA), PUNJAB",PUNJAB,22.7,5.8,7.2,640.0,6.0,4.3,1450.0,4073.0,2014.0,132.4716455072464,0
1024,"GHAGGAR AT 100M D/S CONF. WITH R. SARASWATI (PATIALA),PUNJAB",PUNJAB,19.0,4.8,7.6,1090.0,22.0,3.6,30500.0,52500.0,2014.0,938.5399217391304,0
1295,"GHAGGAR NEAR BANKARPUR,DERA BASSI,PUNJAB",PUNJAB,23.0,5.5,7.3,705.0,10.0,5.0,2020.0,5433.0,2014.0,184.0459397101449,0
1473,"GHAGGAR AT RATANHERI, D/S OF PATIALA NADI (AFTER CONFL.), PUNJAB",PUNJAB,24.0,5.1,7.4,1375.0,23.7,5.9,27333.0,50333.0,2014.0,878.5197875362319,0
1698,"D/S CHHATBIR, PUNJAB",PUNJAB,24.7,5.5,7.4,745.0,10.0,6.1,12167.0,29333.0,2014.0,415.4177063768117,0
1699,"U/S DHAKANSU NALLAH, PUNJAB",PUNJAB,25.0,5.0,7.6,975.0,16.3,6.1,11167.0,21667.0,2014.0,453.3268211594203,0
1700,"D/S DHAKANSU NALLAH, PUNJAB",PUNJAB,22.0,4.9,7.7,1385.0,27.5,7.7,42500.0,72000.0,2014.0,1258.4840014492754,0
1701,"D/S JHARMAL NADI, PUNJAB",PUNJAB,24.3,5.0,7.3,1067.0,19.3,6.2,21467.0,39533.0,2014.0,706.2665144927537,0
1702,"U/S JHARMAL NADI, PUNJAB",PUNJAB,23.3,5.3,7.2,970.0,13.3,5.9,3167.0,7133.0,2014.0,238.36311362318844,0
1703,"GHAGGER AT MOONAK, PUNJAB",PUNJAB,19.5,4.9,7.7,1418.0,21.0,4.2,28000.0,49500.0,2014.0,875.1705947826088,0
1704,"D/S SARDULGARH, PUNJAB",PUNJAB,21.5,4.1,7.5,1015.0,23.0,6.1,35000.0,57500.0,2014.0,1049.830363768116,0
1705,"U/S SARDULGARH, PUNJAB",PUNJAB,20.0,4.8,7.4,854.0,17.0,4.7,20500.0,38000.0,2014.0,666.6862684057971,0
1025,"GHAGGAR GHNAN1 AT ROAD BRDG. SIRSA,DEBWALI ROAD,HARYANA",HARYANA,27.0,6.7,8.2,198.0,19.8,0.0,233.0,465.0,2014.0,239.4026295652174,0
1026,"GHAGGAR GHNAN2 AT CHANDARPUR SYPHON,  HARYANA",HARYANA,27.0,6.7,7.9,198.0,18.2,0.0,233.0,465.0,2014.0,220.0314295652174,0
1718,"GAGGAR RIVER WHEN ENTERING IN RAJASTHAN FROM HARYANA NEAR RD NO. 629, RAJASTHAN",RAJASTHAN,32.6,4.0,6.8,370.0,3.0,0.8,4.0,9.0,2014.0,74.33846405797102,1
1871,"RIVER MARKANDA AT PAONTA, DISTT. SIRMOUR, H.P.",HIMACHAL PRADESH,23.6,7.8,7.8,376.0,1.3,0.4,9.0,17.0,2014.0,58.438606376811606,1
2624,MARKANDA U/S KALA AMB,HIMACHAL PRADESH,23.9,7.7,7.7,354.0,1.3,0.3,12.0,22.0,2014.0,57.235320000000016,1
2625,MARKANDA D/S KALA AMB/ BOUNDARY OF HARYANA,HIMACHAL PRADESH,24.5,7.6,7.9,344.0,1.6,0.4,12.0,22.0,2014.0,63.852740289855085,1
1884,KALA AMB D/S MARKANDA RIVER,HARYANA,27.0,6.7,7.2,198.0,88.0,0.0,233.0,465.0,2014.0,825.7490295652176,0
1870,"RIVER SUKHANA AT PARWANOO, DISTT. SOLAN, H.P.",HIMACHAL PRADESH,18.1,4.4,7.1,694.0,41.0,1.2,92.0,224.0,2014.0,416.10522956521737,0
2947,"RIVER JAWAI AT JAWAI DAM, SIROHI, RAJASTHAN",RAJASTHAN,25.1,5.9,8.0,401.0,0.9,0.7,4.0,15.0,2014.0,67.43781855072463,1
1717,"KODRA DAM, MOUNT ABU, RAJASTHAN",RAJASTHAN,22.3,6.0,7.2,106.0,0.8,0.4,4.0,15.0,2014.0,52.08583159420291,1
2948,"RIVER BANDI AT HEMAWAS DAM, PALI, RAJASTHAN",RAJASTHAN,23.7,5.6,7.9,326.0,1.1,0.8,4.0,4.0,2014.0,68.90749275362319,1
2949,"RIVER LUNI AT RANAKPUR DAM, RANAKPUR, PALI, RAJASTHAN",RAJASTHAN,23.9,6.2,8.1,592.0,1.0,0.7,4.0,6.0,2014.0,68.65579768115941,1
3383,"BUGI RIVER AT MIBANPARA, SOUTH GARO HILLS",MEGHALAYA,25.5,7.2,7.5,119.0,2.3,3.8,33.0,74.0,2014.0,65.82726144927534,1
3384,"BUGI RIVER AT DALU, SOUTH GARO HILLS",MEGHALAYA,25.1,7.2,7.5,120.0,2.3,4.1,31.0,67.0,2014.0,65.81454144927537,1
3380,"DAMRING RIVER (KRISHNEI RIVER) AT RESUBELPARA, EAST GARO HILLS",MEGHALAYA,25.2,7.5,7.3,82.0,1.8,2.8,30.0,70.0,2014.0,56.30134724637681,1
1632,"GANOL RIVER TURA, MEGHALAYA",MEGHALAYA,23.2,7.5,7.5,111.0,2.4,3.0,293.0,506.0,2014.0,71.02101391304349,1
1428,"KYRHUKHLA NEAR SUTNGA KHLIERIAT,JAINTIA HILLS DT.,MEGHALAYA",MEGHALAYA,20.1,5.3,3.3,831.0,7.7,3.2,18.0,36.0,2014.0,49.60789362318838,2
3369,"KYNSHI RIVER AT SOHIONG, WEST KHASI HILLS",MEGHALAYA,18.3,7.2,7.2,56.0,1.7,2.6,21.0,42.0,2014.0,54.89076144927537,1
3370,"KYNSHI RIVER AT NANGKHNUM, WEST KHASI HILLS",MEGHALAYA,19.3,7.5,7.2,66.0,1.6,2.5,22.0,44.0,2014.0,52.576107246376814,1
3371,"KYNSHI RIVER AT RANIKOR, WEST KHASI HILLS",MEGHALAYA,24.0,7.8,7.0,74.0,2.3,4.3,28.0,108.0,2014.0,54.202486376811606,1
3376,LUKHA RIVER AT SUNAPUR (TRIBUTARY OF LUNAR),MEGHALAYA,21.2,7.3,6.6,274.0,2.5,2.4,176.0,386.0,2014.0,54.60254782608695,1
3381,"MANDA RIVER (DUDHAI RIVER) AT JAMPA, EAST GARO HILLS",MEGHALAYA,26.3,7.4,7.3,67.0,1.8,2.5,25.0,55.0,2014.0,56.63253420289855,1
3382,"MANDA RIVER (DUDHAI RIVER) AT WAGAISI, EAST GARO HILLS",MEGHALAYA,25.5,7.2,7.4,82.0,2.0,2.8,26.0,61.0,2014.0,61.16062811594204,1
3377,"MYNTANG RIVER AT NARTIANG, JAYANTIA HILLS",MEGHALAYA,20.0,7.3,7.1,55.0,1.9,2.5,24.0,53.0,2014.0,54.50164115942029,1
3378,"MYNTANG RIVER AT MYNSO, JAYANTIA HILLS",MEGHALAYA,20.3,7.3,7.1,57.0,2.0,2.4,24.0,50.0,2014.0,55.37568782608696,1
1631,"MYNTDU RIVER JOWAI, MEGHALAYA",MEGHALAYA,19.4,6.6,7.1,114.0,2.6,2.8,2142.0,3108.0,2014.0,111.59132985507247,0
3379,"MYNTDU RIVER AT LESHKA, JAYANTIA HILLS",MEGHALAYA,21.0,7.3,5.6,56.0,1.8,2.1,16.0,34.0,2014.0,27.351947826086956,2
3367,"NONBAH RIVER AT NANGSTOIN MARKE, WEST KHASI HILLS",MEGHALAYA,19.2,5.1,7.0,105.0,3.6,4.7,351.0,780.0,2014.0,86.03612753623189,0
3368,"NONBAH RIVER AT NANGSTOIN MARKE, WEST KHASI HILLS",MEGHALAYA,18.3,7.3,7.1,51.0,1.6,2.4,19.0,40.0,2014.0,51.72086782608695,1
3372,"RILANG RIVER AT MAWKYRWAT, WEST KHASI HILLS",MEGHALAYA,19.6,7.7,7.2,50.0,1.6,2.0,19.0,36.0,2014.0,51.48768666666666,1
1633,"SIMSANG RIVER WILLIAMNAGAR, MEGHALAYA",MEGHALAYA,23.7,7.6,7.3,115.0,2.1,3.7,301.0,528.0,2014.0,64.67138028985508,1
3353,"UMIAM MAWPHLANG RIVER AT NONGKREM, EAST KHASI HILLS",MEGHALAYA,18.2,6.2,7.0,81.0,2.4,5.1,36.0,79.0,2014.0,63.04450434782608,1
3354,"UMIAM MAWPHLANG RIVER AT UMTYNGNGAR, EAST KHASI HILLS",MEGHALAYA,18.8,7.2,7.1,66.0,1.9,3.4,28.0,63.0,2014.0,55.174148115942025,1
3355,"UMIAM MAWPHLANG RIVER AT MAWPHLANG, EAST KHASI HILLS",MEGHALAYA,18.9,7.4,7.1,57.0,1.5,2.9,13.0,40.0,2014.0,50.27796753623189,0
3356,"UMIAM MAWPHLANG RIVER AT SHELLA, EAST KHASI HILLS",MEGHALAYA,25.1,7.5,7.4,144.0,1.7,3.5,26.0,59.0,2014.0,57.15150057971015,1
