,STATION CODE,LOCATIONS,STATE,Temp,DO,PH,Conductivity,BOD,NI,Fec_col,Tot_col,WQI,WQI clf
0,1533.0,"*DIGBOI, TINSUKIA DISTT.,  ASSAM",Assam,23.5,6.6,6.5,748.0,1.4,7.0,18.0,12000.0,46.167449855072455,2
1,1534.0,"*KARBI  ANGLONG DISTT., ASSAM",Assam,23.5,6.6,6.4,338.0,1.1,0.7,75.0,5500.0,40.826549855072464,2
2,1535.0,"*SIBSAGAR , ASSAM",Assam,24.5,6.6,7.0,333.0,1.4,0.5,0.0,91.0,51.0277031884058,1
3,1536.0,"*SIBSAGAR, ASSAM",Assam,22.5,6.6,5.7,791.0,1.9,0.3,0.0,46.0,32.95469652173913,2
4,1537.0,"*(JORHAT, ASSAM",Assam,24.5,6.6,7.0,510.0,2.2,3.1,54.0,3350.0,60.34288985507247,1
5,1538.0,"*SILCHAR, ASSAM",Assam,22.0,6.6,5.1,125.0,0.7,3.7,18.0,2300.0,13.035189855072455,3
6,1539.0,"*BARPETA, ASSAM",Assam,27.5,6.6,6.8,599.0,2.0,1.5,0.0,0.0,53.01473652173913,1
7,1540.0,"*BONAIGAON, ASSAM",Assam,27.5,6.6,5.9,446.0,1.1,0.3,0.0,0.0,29.259076521739143,2
8,1541.0,"*GUWAHATI, ASSAM",Assam,23.0,6.6,6.4,1048.0,2.4,9.8,120.0,12115.0,55.935083188405805,1
9,1542.0,"*GUWAHATI, ASSAM",Assam,25.0,6.6,6.9,716.0,1.5,0.9,18.0,46.0,50.692796521739126,0
10,2243.0,"GROUND WATER FROM LEDO, MARGHERITA",Assam,23.0,6.6,5.7,591.0,0.8,8.3,0.0,0.0,24.038043188405798,3
11,2244.0,GROUND WATER FROM NAZIRA,Assam,23.0,6.6,6.6,562.0,1.1,3.6,4650.0,4669.0,145.5895765217391,0
12,2245.0,GROUND WATER FROM NUMALIGARH (NEAR NRL TE LABOR COLONY),Assam,26.5,6.6,5.7,248.0,1.0,2.5,230.0,966.0,30.394369855072465,2
13,2246.0,GROUND WATER FROM SEMENCHAPARI,Assam,21.0,6.6,6.6,544.0,0.8,0.1,0.0,0.0,38.75516985507246,2
14,2247.0,GROUND WATER FROM SILAPATHAR,Assam,21.0,6.6,6.2,649.0,0.5,3.3,0.0,18.0,29.53249652173913,2
15,2248.0,GROUND WATER FROM LAKHIMPUR TOWN,Assam,26.0,6.6,6.6,817.0,2.2,5.6,0.0,195.0,51.8522631884058,1
16,2249.0,GROUND WATER FROM TEZPUR (MISSION CHARIALI),Assam,27.0,6.6,6.1,195.0,1.1,1.3,0.0,18.0,32.78914985507246,2
17,2250.0,GROUND WATER FROM NAGAON (PANIGAON),Assam,28.5,6.6,6.6,475.0,0.6,1.6,0.0,0.0,37.133589855072465,2
18,2251.0,GROUND WATER FROM JAGIROAD NEAR HPC EFFLUENT DISCHARGE POINT,Assam,27.0,6.6,6.5,1322.0,2.4,7.3,37.0,5500.0,54.16842985507246,1
19,2252.0,GROUND WATER NEAR MSW DUMPING SITE AT GARCHUK-GUWAHATI,Assam,24.0,6.6,6.4,417.0,1.3,0.1,0.0,0.0,39.68122985507247,2
20,2253.0,GROUND WATER FROM NALBARI,Assam,25.5,6.6,6.9,601.0,1.1,5.5,0.0,0.0,47.22170985507247,2
21,2254.0,GROUND WATER FROM BARPETA ROAD(RLY STATION),Assam,28.6,6.6,6.9,1038.0,0.3,0.2,465.0,55000.0,62.03328318840581,1
22,2255.0,"GROUND WATER NEAR BPRL, DHALIGAON",Assam,29.3,6.6,6.9,747.0,0.8,6.1,0.0,2300.0,45.16982985507247,2
23,2256.0,GROUND WATER FROM KOKRAJHAR DISTRICT (HS SCHOOL ),Assam,28.5,6.6,6.5,515.0,0.6,4.0,46.0,645.0,36.827289855072465,2
24,2257.0,GROUND WATER FROM DHUBRI DISTRICT (COLLEGE NAGAR ),Assam,29.1,6.6,7.2,883.0,0.9,0.3,1150.0,1196.0,75.83093652173913,0
25,2258.0,GROUND WATER FROM GOALPARA DIST. (GOALPARA COLLEGE ),Assam,30.0,6.6,6.6,539.0,0.8,3.0,0.0,1265.0,39.34943652173913,2
26,2259.0,GROUND WATER FROM DIPHU (GOVT. COLLEGE),Assam,28.5,6.6,7.4,1515.0,1.8,1.6,0.0,0.0,61.87278985507247,1
27,2261.0,GROUND WATER FROM HAFLONG,Assam,16.0,6.6,7.1,566.0,2.2,0.2,0.0,75.0,59.860243188405796,1
28,2262.0,GROUND WATER FROM KARIMGANJ (COLLEGE),Assam,12.0,6.6,6.5,330.0,0.9,4.7,0.0,430.0,38.4548231884058,2
29,2263.0,GROUND WATER FROM HIALAKANDI (NEAR ASTC BUS STAND ),Assam,16.5,6.6,6.6,363.0,0.5,1.1,0.0,0.0,36.16908318840579,2
30,2264.0,GROUND WATER IN PANCHGRAM MARKET NEAR CACHAR PAPER MILL,Assam,17.5,6.6,6.5,662.0,3.6,2.3,455.0,14640.0,75.3475631884058,0
31,19.0,"WELL AT ELOOR, KERALA",Kerala,27.5,6.6,6.2,159.0,1.0,2.6,150.0,370.0,37.1666031884058,2
32,22.0,"WELL AT CHUNGAPALLY, KERALA",Kerala,25.0,6.6,6.7,114.0,0.4,0.9,184.0,226.0,41.05935652173913,2
33,35.0,"WELL AT PUNALUR, KERALA",Kerala,24.0,6.6,6.0,195.0,0.6,0.8,162.0,270.0,30.2081231884058,2
34,1581.0,"PAPPANAMKODE, THIRUVANANTHAPURAM, KERALA",Kerala,25.8,6.6,6.4,354.0,1.3,1.2,95.0,285.0,41.94983652173914,2
35,1582.0,"NEDUMANGAD, THIRUVANANTHAPURAM, KERALA",Kerala,25.8,6.6,7.2,160.0,4.0,2.7,69.0,210.0,79.26845652173913,0
36,1583.0,"KUNDARA, KOLLAM DISTT. , KERALA",Kerala,23.0,6.6,4.7,159.0,0.5,0.8,1.0,33.0,3.136763188405801,3
37,1584.0,"CHERTHALA, ALLEPPY, KERALA",Kerala,28.3,6.6,7.7,177.0,0.8,0.0,160.0,245.0,61.34939652173913,1
38,1585.0,"VYTTILA, ERNAKULAM DISTT. , KERALA",Kerala,28.6,6.6,7.7,405.0,3.1,5.2,76.0,455.0,80.51748985507245,0
39,1586.0,"EDAYAR ERNAKULAM DISTT., KERALA",Kerala,27.8,6.6,5.7,328.0,1.0,5.7,7.0,14.0,25.624096521739133,0
40,1587.0,"KALAMASSERY ERNAKULAM DISTT. , KERALA",Kerala,28.0,6.6,6.9,248.0,0.9,8.1,116.0,361.0,48.30093652173913,2
41,1588.0,"PUNKUNNAM TRISSUR DISTT. , KERALA",KERALA,29.0,6.6,7.6,270.0,1.0,1.5,160.0,585.0,61.64305652173913,1
42,1589.0,"MALAPURAM , KERALA",Kerala,29.3,6.6,6.8,285.0,0.6,0.7,2.0,16.0,40.51310985507246,2
43,1590.0,"MAVOOR, KOZHIKKODE DISTT. , KERALA",Kerala,26.0,6.6,6.7,101.0,0.6,1.6,181.0,404.0,42.87628985507247,2
44,1591.0,"KANNUR (MUNICIPALITY) KANNUR DISTTM , KERALA",Kerala,29.0,6.6,5.5,99.0,1.0,3.3,2.0,16.0,21.72925652173913,3
45,1592.0,"PAYYANNUR, KANNUR DISTT. , KERALA",Kerala,28.0,6.6,6.6,164.0,1.2,2.3,1.0,18.0,42.47896318840579,2
46,2308.0,FATHIMAPURAM (CHANGANASSERY),Kerala,28.3,6.6,6.5,281.0,0.4,5.6,795.0,1695.0,51.9642431884058,1
47,2309.0,KAROOR (PALA),Kerala,28.0,6.6,5.7,93.0,0.7,2.9,640.0,1250.0,36.871883188405796,2
48,2310.0,VAIKOM,Kerala,27.5,6.6,6.2,157.0,0.5,2.7,655.0,1615.0,44.18549652173914,2
49,2311.0,VADAVATHOOR (KOTTAYAM),Kerala,27.3,6.6,6.2,137.0,0.4,6.8,340.0,605.0,36.5604631884058,2
50,2313.0,"SARVODAPURAM, ALAPPUZHA",Kerala,28.0,6.6,7.8,249.0,1.1,0.0,320.0,505.0,69.35003652173913,1
51,2314.0,KUREEPUZHA (KOLLAM),Kerala,24.0,6.6,6.4,205.0,1.2,2.5,160.0,460.0,42.64898985507247,2
52,2315.0,K.M.M.L. (KOLLAM),Kerala,24.0,6.6,7.9,488.0,1.9,1.7,111.0,267.0,73.73482318840581,1
53,2316.0,CHELLORA TRENCHING GROUND (KANNUR),Kerala,27.5,6.6,5.2,63.0,1.0,1.2,15.0,165.0,16.60381652173913,3
54,2317.0,PUNNALPETTIPPALAM (TELLICHERRY MUNICIPALITY,Kerala,27.5,6.6,6.0,313.0,1.0,5.5,2.0,15.0,30.696649855072465,2
55,2320.0,MANJERI,Kerala,29.0,6.6,6.6,237.0,0.5,2.1,11.0,55.0,36.50589652173912,2
56,2321.0,LALOOR (THRISSUR),Kerala,30.0,6.6,6.7,280.0,1.9,4.1,170.0,640.0,54.50542318840579,1
57,2322.0,OLLUR (THRISSUR),Kerala,29.5,6.6,5.2,208.0,53.2,2.3,155.0,505.0,481.9991831884058,0
58,2323.0,BRAHMAPURAM M.S.W. DUMPARK (ERNAKULAM),Kerala,27.6,6.6,5.8,299.0,0.9,5.5,740.0,1065.0,42.87716985507246,2
59,2324.0,HAZARDOUS WASTE DUMP (AMBALAMUGHAL),Kerala,27.8,6.6,7.0,157.0,1.9,0.4,7.0,13.0,55.541589855072466,1
60,2327.0,KARUKAMANI,Kerala,30.0,6.6,7.0,885.0,0.8,1.8,245.0,390.0,51.460356521739136,1
61,3463.0,"WELL AT VELLIPARAMBA, KOZHEKODE",Kerala,27.5,6.6,6.2,105.0,0.6,2.7,180.0,406.0,34.295776521739135,2
62,3472.0,"WELL OF TEMPLE PARASSINIKADAVU, KANNUR",Kerala,29.0,6.6,7.6,831.0,0.9,1.8,4.0,7.0,57.33931652173913,1
63,3474.0,"WELL AT PAYANOOR, KANNUR",Kerala,28.5,6.6,7.4,186.0,1.4,2.3,4.0,16.0,58.208063188405795,1
64,3475.0,"WELL AT KARIMBAM, KANNUR",Kerala,27.0,6.6,6.2,110.0,1.0,2.0,0.0,5.0,33.6949231884058,2
65,1593.0,"WELL NEAR J.B SCHOOL, LAKSHDWEEP",Lakshadweep,30.1,6.6,7.3,951.0,2.4,0.0,4000.0,22333.0,158.46223652173913,0
66,1594.0,"WELL NEAR OTTAVATHIL PALLI, LAKSHDWEEP",Lakshadweep,29.9,6.6,7.2,1727.0,2.4,0.0,1333.0,8909.0,95.00297652173913,0
67,1595.0,"WELL NEAR CHEKKILLAM HOUSE, LAKSHDWEEP",Lakshadweep,29.7,6.6,7.2,777.0,2.4,0.0,25857.0,37250.0,643.0093965217392,0
69,1598.0,"WELL C/O PUTHIYA PALLI., LAKSHDWEEP",Lakshadweep,30.0,6.6,7.3,768.0,2.4,0.0,5952.0,67533.0,211.50517652173914,0
70,1599.0,"WELL C/O PURATHA PALLI, LAKSHDWEEP",Lakshadweep,29.7,6.6,7.1,810.0,2.4,0.0,1000.0,32000.0,90.78595652173912,0
71,1600.0,WELL C/O ANDAM PALLILAKSHDWEEP,Lakshadweep,30.1,6.6,7.0,937.0,2.4,0.0,1289.0,26864.0,94.33487652173912,0
72,1601.0,WELL C/O CIRCUIT HOUSELAKSHDWEEP,Lakshadweep,29.8,6.6,7.2,2012.0,2.4,0.0,9000.0,145773.0,294.61645652173917,0
73,1602.0,"WELL C/O GOVT. PRESS, LAKSHDWEEP",Lakshadweep,29.3,6.6,7.3,1645.0,2.4,0.0,4000.0,25250.0,159.25665652173913,0
74,1603.0,"WELL C/O OLD POLICE BARRACKS, LAKSHDWEEP",Lakshadweep,29.5,6.6,7.2,2842.0,2.4,0.0,8500.0,60333.0,264.9522565217392,0
75,1605.0,"WELL NEAR HALIPAD, LAKSHDWEEP",Lakshadweep,29.6,6.6,7.3,1254.0,2.4,0.0,6500.0,241873.0,262.07769652173914,0
76,1606.0,"PUBLIC WELL OPPOSITE S.B.SCHOOL, LAKSHDWEEP",Lakshadweep,29.9,6.6,7.3,902.0,2.4,0.0,3000.0,77692.0,148.53043652173915,0
77,1397.0,"WELL AT MUTHIALPET AREA(I), PONDICHERRY",PONDICHERRY,30.3,6.6,7.4,3320.0,2.4,0.4,120.0,554.17,70.22380725507247,1
78,1398.0,"WELL AT THENGAITHITTU AREA, (II) PONDICHERRY",PONDICHERRY,30.7,6.6,7.4,1460.0,2.4,0.1,120.0,554.17,69.78180725507245,1
79,1453.0,"WELL AT MUTHARAPLATYAM (PWD), PONDICHERRY",PONDICHERRY,30.7,6.6,7.3,597.0,2.4,4.7,120.0,554.17,68.3588805884058,1
80,1454.0,"WELL AT KALAPET, PONDI. UNIVER. ADMN. BLOCK, PONDICHERRY",PONDICHERRY,30.0,6.6,7.1,207.0,2.4,1.2,120.0,554.17,64.41841392173913,1
81,1687.0,"NEHRU STATUE, PONDICHERRY",PONDICHERRY,30.0,6.6,7.2,1795.0,2.4,0.9,120.0,554.17,66.47097392173913,1
82,1688.0,"KATTERIKUPPAM, PODICHERRY",PONDICHERRY,30.0,6.6,7.5,549.0,2.4,0.5,120.0,554.17,71.3611205884058,1
83,1689.0,"CHUNMBAR RIVER, PONDICHERRY",PONDICHERRY,29.3,6.6,8.1,1193.0,6.3,0.0,120.0,554.17,116.38693392173913,0
84,2009.0,KURUMBAPET,PONDICHERRY,30.7,6.6,7.5,550.0,2.4,5.5,120.0,554.17,71.90800725507246,1
85,2010.0,METTUPALAYAM,PONDICHERRY,32.0,6.6,7.6,1248.0,2.4,0.6,120.0,554.17,73.26183392173914,1
86,2011.0,URUVAIYAR,PONDICHERRY,32.0,6.6,7.5,3207.0,2.4,0.0,120.0,554.17,71.89121392173912,1
87,2012.0,KARUVADIKUPPAM,PONDICHERRY,31.3,6.6,7.5,1597.0,2.4,0.6,120.0,554.17,71.60261392173913,1
88,2013.0,"T.R.PATTINAM, KARAIKAL",PONDICHERRY,27.5,6.6,7.5,1719.0,1.0,1.0,120.0,554.17,59.28038725507246,1
89,2014.0,"VADAMATTAM, KARAIKAL",PONDICHERRY,28.2,6.6,7.4,1514.0,2.4,0.8,120.0,554.17,69.87022058840581,1
90,2446.0,PALLUR,PONDICHERRY,32.0,6.6,6.7,255.0,2.4,5.8,120.0,554.17,57.987907255072464,1
91,2447.0,PANTHAKKAL,PONDICHERRY,32.0,6.6,6.8,126.0,2.4,1.6,120.0,554.17,59.23632725507247,1
92,1736.0,"GROUND WATER QUALITY STATION SARDARNAGAR, U.P",Uttar Pradesh,23.0,6.6,6.9,1058.0,5.1,4.0,90.0,195.0,84.59814985507248,0
93,1737.0,"GROUND WATER QUALITY STATION CAPTANGANJ, U.P",Uttar Pradesh,22.5,6.6,6.9,765.0,3.5,2.9,35.0,70.0,69.00722318840579,1
94,1738.0,"SITE 1, INDUSTRIAL AREA NEAR M/S WOODWARM CHEMICAL LTD., UNNAO, U.P",Uttar Pradesh,26.0,6.6,7.7,674.0,2.4,0.0,120.0,554.17,74.80595392173913,1
95,1739.0,"SITE 2, INDUSTRIAL AREA NEAR M/S AMIN SONS, UNNAO, U.P",Uttar Pradesh,26.0,6.6,7.4,2987.0,2.4,0.0,120.0,554.17,70.10681392173913,1
96,1740.0,"AT ROADWAYS BUS STATION, UNNAO, U.P",Uttar Pradesh,26.0,6.6,7.3,2940.0,2.4,0.0,120.0,554.17,68.36047392173913,1
97,1741.0,"MAGAWARA INDUSTRIAL AREA NEAR M/S JAMJAM TANNERS, UNNAO, U.P",Uttar Pradesh,26.0,6.6,7.5,1202.0,2.4,0.0,120.0,554.17,71.45011392173913,1
98,1742.0,"Handpump near India Pesticide Ltd., Chinhat ind Area",Uttar Pradesh,25.4,6.6,7.2,613.0,0.1,0.2,120.0,554.17,45.7748005884058,2
99,1744.0,"JAJMAU INDUSTRIAL AREA NO. 6 KANPUR, U.P",Uttar Pradesh,29.0,6.6,6.9,3923.0,2.4,3.9,120.0,554.17,62.05913392173913,1
100,1745.0,"PANKI INDUSTRIAL AREA NEAR INDUSTRY OF AMMONIA FERTIZER KANPUR, U.P",Uttar Pradesh,29.0,6.6,7.4,1109.0,2.4,4.2,120.0,554.17,70.15285392173914,1
101,1746.0,Nagar Palika Tube well Sultanpur,Uttar Pradesh,20.7,6.6,7.7,622.0,2.4,0.2,120.0,554.17,74.81638058840579,1
102,1747.0,"India Marka hand pump,Sareny, Raebareli",Uttar Pradesh,21.0,6.6,7.8,732.0,2.4,0.2,120.0,554.17,76.57658058840579,0
103,1749.0,"TUBE WELL AT MEERUT CITY, U.P",Uttar Pradesh,22.0,6.6,7.2,625.0,2.4,0.4,120.0,554.17,66.15890725507246,1
104,1750.0,"TUBE WELL AT BAGPAT CITY, U.P",Uttar Pradesh,22.5,6.6,7.6,700.0,2.4,0.4,120.0,554.17,73.11940725507246,1
105,1752.0,"SAHIBABAD INDUSTRIAL AREA, GHAZIABAD, U.P",Uttar Pradesh,23.3,6.6,6.9,2450.0,2.4,2.6,120.0,554.17,61.5929405884058,1
106,1753.0,"MEERUT ROAD INDUSTRIAL AREA GHAZIABAD, U.P",Uttar Pradesh,23.5,6.6,6.7,1812.0,2.3,1.4,120.0,554.17,56.9641805884058,1
107,1754.0,"HAPUR ROAD INDUSTRIAL AREA GHAZIABAD, U.P",Uttar Pradesh,23.4,6.6,6.8,1160.0,1.7,2.0,120.0,554.17,53.3111405884058,1
108,1755.0,"PILKHUA INDUSTRIAL AREA GHAZIABAD, U.P",Uttar Pradesh,24.0,6.6,6.9,1505.0,2.4,1.1,120.0,554.17,61.2210405884058,1
109,1757.0,"Hand Pump, Mirzapur Industrial area Mirzapur",Uttar Pradesh,23.4,6.6,7.3,1377.0,0.2,4.4,120.0,554.17,49.0232805884058,2
110,1759.0,"IFFCO, PHOOLPUR, ALLAHABAD, U.P",Uttar Pradesh,23.4,6.6,7.2,1286.0,0.3,0.7,120.0,554.17,47.74792725507246,2
111,1760.0,"M/S KANORIA CHEMICAL SONBHADRA, U.P",Uttar Pradesh,23.7,6.6,6.9,1297.0,0.4,5.7,120.0,554.17,43.97421392173913,2
112,1761.0,"TUBE WELL IN SINGRAULI INDUSTRIAL AREA, U.P",Uttar Pradesh,23.4,6.6,7.3,999.0,0.4,0.8,120.0,554.17,50.31692058840579,0
113,1769.0,"Hand Pump, At Industrial Area Naini, Allahabad",Uttar Pradesh,28.9,6.6,7.3,2554.0,0.6,0.7,120.0,554.17,52.41848725507246,1
114,2469.0,"AT INDUSTRIAL AREA. NAINI, ALLAHABAD",Uttar Pradesh,23.8,6.6,7.6,1142.0,0.3,0.0,120.0,554.17,54.58371392173913,1
115,2469.0,"AT INDUSTRIAL AREA. NAINI, ALLAHABAD",Uttar Pradesh,23.8,6.6,7.6,1092.0,0.2,0.8,120.0,554.17,53.774980588405796,1
116,2470.0,"AT INDUSTRIAL AREA, FATEHPUR",Uttar Pradesh,23.4,6.6,7.2,1305.0,0.4,1.9,120.0,554.17,48.768507255072464,2
117,2471.0,"GORAKHPUR INDUSTRIAL DEVELOPMENT AUTHORITY AREA (GIDA), GORAKHPUR",Uttar Pradesh,21.5,6.6,8.0,491.0,2.4,0.4,50.0,105.0,78.37160985507246,0
118,2472.0,"VILLAGE DAURALA, MEERUT",Uttar Pradesh,22.5,6.6,7.6,1010.0,2.4,0.2,120.0,554.17,73.1657405884058,1
119,2473.0,"KHEKRA, BAGHPAT",Uttar Pradesh,20.5,6.6,7.5,460.0,2.4,0.4,120.0,554.17,71.33060725507247,1
120,2474.0,"India Marka hand pump,Unchahar, Raebareli",Uttar Pradesh,20.5,6.6,7.8,697.0,2.4,0.3,120.0,554.17,76.57981392173912,0
121,2475.0,"India Marka hand pump, Ind. Area, Sultanpur Road,Raebareli",Uttar Pradesh,21.5,6.6,8.0,725.0,2.4,0.4,120.0,554.17,80.06890725507246,0
122,2477.0,NEAR ARYA KANYA INTER COLLEGE. JALAUN,Uttar Pradesh,26.2,6.6,7.6,1382.0,2.4,0.0,0.0,0.0,70.45179652173913,1
123,2478.0,"Handpump near Uptron Police Chowki Dewa road,",Uttar Pradesh,25.4,6.6,7.4,560.0,0.3,0.2,120.0,554.17,51.0055405884058,1
124,2480.0,"NEAR BRAHMAN MAJRA, PILKHANI",Uttar Pradesh,20.0,6.6,7.5,380.0,2.4,0.0,120.0,554.17,71.26927392173913,1
125,2267.0,"CREEK AT DANDO MOLLO,VELSAO, MAMUGAO",GOA,30.22,6.5,6.74,124.69,1.62,10.17,4442.0,9886.67,150.27730267826087,0
126,2081.0,AMLAKHADI CREEK AT PUNGAM.,GUJARAT,30.5,1.99,7.74,3164.58,32.31,3.44,2592.5,15173.3,421.224275484058,0
127,2793.0,"THANE CREEK AT KALWA ROAD BRIDGE, KALWA, THANE",MAHARASHTRA,28.25,3.43,7.41,16482.9,21.61,1.91,525.0,827.08,267.7662553101449,0
128,2791.0,"ULHAS CREEK AT RETI BUNDER, D/S OF KALYAN- BHIWANDI BDG",MAHARASHTRA,27.73,4.53,7.17,5798.36,18.55,1.92,478.55,723.64,227.82197152173916,0
129,2792.0,"ULAHS CREEK AT MUMBRA RETI BUNDER, VILLAGE MUMBRA, THANE",MAHARASHTRA,28.08,4.65,7.52,21734.8,11.48,2.39,324.17,653.75,170.86725684057967,0
130,2794.0,"ULHAS CREEK AT KOSHLET RETI BUNDER, KOLSHET, THANE",MAHARASHTRA,28.5,5.4,7.37,17271.6,9.5,2.23,188.08,428.75,143.07165833333332,0
131,2795.0,"ULHAS CREEK AT GAIMUKH AT NAGLA BUNDER ON GHOD BUNDER ROAD, NAGLA, THANE",MAHARASHTRA,28.42,4.88,7.59,24135.6,10.08,2.03,178.33,437.92,155.8014262405797,0
132,2800.0,"SARAWALI CREEK, SARAWALI, PALGHAR, THANE",MAHARASHTRA,27.58,4.88,7.88,10203.7,8.68,3.49,336.67,498.33,149.05023910724637,0
133,2803.0,"PANVEL CREEK AT KOPRA BRIDGE, KOPRA, PANVEL, RAIGAD",MAHARASHTRA,29.18,4.87,6.9,19209.8,9.7,1.4,157.73,321.36,138.8739157362319,0
134,2804.0,KARAMBAVANE CREEK AT CHIPLUN.,MAHARASHTRA,23.25,6.55,7.32,3484.4,2.75,1.55,4.0,122.5,69.67708466666667,1
135,2814.0,"SEA WATER AT BHAGWATI BUNDER, RATNAGIRI NEAR ULTRA TECH CEMENT JETTY AT MIRKARWADA.",MAHARASHTRA,28.09,5.97,8.03,24728.2,3.95,2.9,4.0,124.55,100.23707601449273,0
136,2815.0,MADVI SEA  WATER  AT RATNAGIRI NEAR JODHALE MARUTI TEMPLE AT MADVIGAON.,MAHARASHTRA,27.42,5.85,8.06,26033.0,4.2,3.02,4.42,132.5,103.85938736231887,0
137,2354.0,"SAMARLA KOTA CANAL, KAKINADA,EAST GODAVARI",ANDHRA PRADESH,24.55,5.85,7.37,338.18,1.13,0.52,3.0,716.91,58.87634182898552,1
138,2355.0,"TULJE BAGH CANAL, TEKRI DRAIN,KAKINADA,EAST GODAVARI,",ANDHRA PRADESH,26.0,5.98,7.37,4849.55,1.31,1.77,3.09,793.82,60.992366052173914,1
139,3051.0,"BUDAMERU CANAL NR BDG AT NH-5, KEESARAPALLY,  KRISHNA",ANDHRA PRADESH,23.38,3.38,7.04,953.88,1.96,0.75,4.0,1437.5,72.71878012173912,1
140,2265.0,"CANAL UP STREAM OF CUNCOLIM INDL.EST. CUNCOLIM,SALCETE (1 KM FROM M/S NICOMENT INDUSTRIES)",GOA,30.5,7.65,5.68,55.3,1.31,0.08,7.0,150.0,22.32507614492753,3
141,2266.0,"CANAL DOWNSTREAM OF CUNCOLIM INDL.EST. CUNCOLIM,SALCETE (NEAR RAILWAY BRIDGE)",GOA,31.5,7.82,5.93,101.8,1.4,0.07,120.0,120.0,29.143744985507244,2
142,2268.0,CUMBARJUA CANAL CORLIM(DISCHARGE POINT OF SYNGENTA LIMITED),GOA,30.0,4.96,6.5,176.53,2.25,0.14,1247.33,3501.67,86.00428627536232,0
143,2073.0,"NARMADA MAIN CANAL, NR. VILLAGE. LIMBADIA, DIST. GANDHINAGAR.",GUJARAT,27.25,7.91,8.21,252.0,2.0,0.39,8.0,24.5,71.17458739130437,1
144,2074.0,"TAPI CANAL AT VILLAGE UMARWADA, NEAR GIDC ESTATE OF PANOLI.",GUJARAT,29.42,7.28,8.08,482.58,2.09,0.54,49.08,321.92,73.78574321739129,1
145,1479.0,WESTERN YAMUNA CANAL AT HAIDERPUR WATER WORKS,DELHI,26.0,6.6,7.7,445.5,2.4,0.79,21500.0,32500.0,554.3681398550725,0
146,1111.0,W.YAM. CANAL C-3 DELHI BRANCH AT R.D.245250,HARYANA,26.67,7.36,7.56,217.33,1.57,0.1,120.0,554.17,61.28259898550724,1
147,1112.0,"W.YAM. CANAL C-4 BEFORE ENTER INTO DELHI BRANCH,R.D.282628",HARYANA,25.67,7.31,7.76,263.33,1.32,0.14,120.0,554.17,62.79663579710145,1
148,1115.0,W.YAM. CANAL C-7 DELHI PARALLEL BRANCH AT KHUBRU FALL RD-145250,HARYANA,26.33,6.98,7.73,217.33,2.02,0.27,120.0,554.17,70.06391608695654,1
149,1116.0,W.YAM. CANAL WC-4 DELHI PARALLEL BRANCH AT PANIPAT,HARYANA,22.0,7.2,7.85,267.5,2.44,0.14,16500.0,196500.0,479.90947144927543,0
150,3034.0,W.YAMUNA CANAL-KHUBRU OUTFALL,HARYANA/CPCB,26.0,6.6,8.15,259.0,1.0,0.79,3300.0,5800.0,141.65230985507247,0
151,1419.0,"GURGAON CANAL, GC-1,(NEAR BADARPUR BORDER)",HARYANA,26.5,1.3,7.95,1115.0,31.5,1.2,120.0,554.17,362.4649826173913,0
152,3461.0,"KANOLI CANAL AT ERANJIKKAL, KAZHEKODE",KERALA,26.56,4.56,7.32,16064.0,1.91,0.55,2911.11,4377.78,139.65650636811597,0
153,3467.0,"UNTHITHODU AT ELOOR, ERNAKULAM",KERALA,28.09,0.97,6.93,1614.78,14.59,4.13,710.0,2577.78,210.57254204057972,0
154,3469.0,"PALAKKATTUTHAZHA-MTHODU AT PERUMBAVOOR, ERNAKULAM",KERALA,27.2,4.73,6.83,68.44,1.76,0.67,756.67,1661.11,77.28776394202899,0
155,2836.0,"MORAMBAMARINE, DISTT. THOUBAL",MANIPUR,29.0,6.57,7.04,149.3,1.59,0.79,120.0,32.0,56.17862194202899,1
156,2428.0,JOBRA( ORIGIN OF TALAGANDA CNAL),ORISSA,27.8,7.94,7.92,173.0,1.78,0.55,40160.0,48200.0,962.0063446376812,0
157,2429.0,"NAUBAZAR, CUTTACK CITY",ORISSA,28.6,6.44,7.94,182.8,2.08,0.89,71400.0,119200.0,1678.2887783188405,0
158,2430.0,"ATHARABANKI(WATER INTAKE POINT OF PPL, IFFCO & PPT)",ORISSA,29.2,7.71,7.83,572.07,3.62,0.82,19640.0,37840.0,522.1842400376812,0
159,2932.0,"NARMADA MAIN CANAL (BEFORE ENTERING IN RAJASTHAN STATE), TEHSIL SANCHORE, JALORE",RAJASTHAN,22.21,6.91,8.08,377.5,1.19,0.4,3.92,10.17,66.49391968985506,1
160,2933.0,"GANG CANAL AT KHAKKA HEAR NEAR HINDUMAL KOT, GANGANAGAR",RAJASTHAN,24.66,5.84,7.27,333.33,1.3,0.57,4.17,13.5,58.56879699130433,1
161,2934.0,MASITAWALA HEAD HANUMANGARH,RAJASTHAN,28.47,5.92,7.08,324.17,1.33,0.53,3.58,11.75,55.13127489275362,1
162,1729.0,"NEAR PRAGATI VIDYABHAWAN, AGARTALA",TRIPURA,28.5,1.33,8.84,384.67,33.51,6.49,640.0,826.67,407.5332272637681,0
163,2726.0,"UPPER GANGA CANAL D/S HARIKIPAURI, HARIDWAR",UTTARANCHAL,18.98,8.25,7.71,124.67,2.68,0.79,120.0,245.46,69.41778367246377,1
164,3035.0,UPPER GANGA CANAL-MURADNAGAR,UTTAR PRADESH/CPCB,26.0,6.6,7.83,457.0,2.4,0.79,40000.0,81000.0,976.1474698550726,0
165,2512.0,"NOAI CANAL NORTH 24 PARGANAS, NEAR GANGA NAGAR MOTIBRIDGE",WEST BENGAL,29.08,1.2,7.16,1196.25,33.72,0.41,36000000.0,49000000.0,806746.0406938406,0
166,3052.0,"GUNTATHIPPA DRAIN B/C WITH RYVES CANAL AT RAMAVARAPPADU,  KRISHNA",ANDHRA PRADESH,22.73,2.33,7.0,1736.36,3.05,1.25,5.27,2572.73,87.22910303188407,0
167,3053.0,"TULIA BAGH DRAIN AT VEMULAVADA,  EAST GODAVARI",ANDHRA PRADESH,26.27,5.8,7.35,12023.3,1.58,1.77,3.45,547.36,65.43312237391305,1
168,3054.0,"OUTLET OF ASH POND EFFLUENTS OF M/S.NTPC, RAMAGUNDAM,  KARIMNAGAR",ANDHRA PRADESH,29.67,3.28,9.51,1169.0,12.49,0.37,264.0,1600.0,215.07815681159423,0
169,3058.0,"OUTLET OF STP, KHAIRATABAD ON HUSSAINSAGAR LAKE, RANGA REDDY",ANDHRA PRADESH,26.71,3.3,7.38,962.0,28.57,10.18,828.33,1142.86,333.7434416202899,0
170,3059.0,"OUTLET OF STP, SAFILGUDA LAKE, RANGA REDDY",ANDHRA PRADESH,27.38,2.06,7.78,1631.7,26.14,9.7,345.0,1483.33,314.6307242811594,0
171,3060.0,"OUTLET OF STP, DURGAM CHERUVU, RANGAREDDY",ANDHRA PRADESH,24.43,2.59,8.12,1691.11,12.68,3.86,365.0,1600.0,198.6776743449275,0
172,3061.0,"OUTLET OF STP, NALLACHERUVU ON MUSI,  RANGAREDDY",ANDHRA PRADESH,27.4,2.83,7.71,1733.5,36.83,14.93,195.0,565.0,401.41621144927535,0
173,3062.0,"OUTLET OF STP, SAROOR NAGAR, RANGAREDDY",ANDHRA PRADESH,27.7,2.31,7.68,1779.45,25.0,15.35,733.33,1271.88,310.7865392231884,0
174,3063.0,"OUTLET OF STP ON RIVER GODAVARI AT MANCHERIAL,  ADILABAD",ANDHRA PRADESH,27.64,3.79,7.61,1573.64,60.36,8.18,115.64,376.36,600.7808106666666,0
175,3064.0,"OUTLET OF 4MLD STP ON RIVER GODAVARI AT RAMAGUNDAM,  KARIMNAGAR",ANDHRA PRADESH,29.5,0.38,7.92,1408.0,32.8,2.68,430.0,900.0,385.03113855072456,0
176,3065.0,"OUTLET OF 14MLD STP ON GODAVARI, RAMAGUNDAM,  KARIMNAGAR",ANDHRA PRADESH,30.1,1.37,7.8,1189.1,42.61,3.36,643.33,1600.0,469.9180793478261,0
177,3066.0,"OUTLET OF STP ON GODAVARI, BHADRACHALAM,  KHAMMAM",ANDHRA PRADESH,20.73,1.92,6.88,1114.36,3.3,1.12,5.09,2118.18,89.07632722028985,0
178,3067.0,"OUTLET OF STP ON GODAVARI, RAJAHMUNDRY,  EAST GODAVARI",ANDHRA PRADESH,25.36,5.85,7.55,298.55,1.13,1.12,11.45,2085.45,62.5458470289855,1
179,1379.0,"DRAIN NO. 8,PEOMANI HARI VILLAGE,SONEPAT",HARYANA,26.0,6.6,7.7,445.5,2.4,0.79,1100.0,2200.0,96.86213985507246,0
180,2178.0,CHIKHALI NALLAH MEETS GODAVARI RIVER.,MAHARASHTRA,24.8,3.75,7.22,1079.33,14.09,12.52,224.55,341.91,187.38589591594203,0
181,2783.0,"COLOUR CHEMICAL NALLAH, VILLAGE- MAJIWADA, THANE",MAHARASHTRA,28.5,1.99,7.37,4585.0,44.53,2.2,1013.75,1295.83,485.2060161507246,0
182,2784.0,"SANDOZ NALLAH, SANDOZBAUG, THANE",MAHARASHTRA,28.45,2.1,7.38,1290.47,55.18,1.81,872.73,1178.18,575.2143588985507,0
183,2789.0,"NALLA AT D/S ALKAI MANDIR, SOLAPUR, VILLAGE-ALKAI, TAL: MALSHIRAJ, DIST: SOLAPUR",MAHARASHTRA,33.67,3.03,7.77,1394.52,14.47,1.08,245.42,1425.0,203.27955726956523,0
184,2790.0,PIMPAL-PANERI NALLA  AT RATNAGIRI NEAR FINOLEX INDUSTRIES AT YAHGANIGAON.,MAHARASHTRA,28.56,6.37,6.86,1272.96,3.6,1.62,5.44,138.89,69.63820752173915,1
185,1509.0,"ETAWAH DRAIN, ETAWAH",UTTAR PRADESH,26.0,6.6,7.7,445.5,2.4,0.79,170000.0,330000.0,3901.6681398550727,0
186,1898.0,"PETROL PUMP OPP. HERO CYCLE, LUDHIANA",PUNJAB,26.0,6.6,7.0,445.5,2.4,1.0,120.0,554.17,62.713017255072465,1
187,1899.0,"BHAGWAN SINGH, H.NO.907, DASMESH NAGAR, GALI NO. 6, LUDHIANA",PUNJAB,26.0,6.6,7.0,445.5,2.4,1.0,120.0,554.17,62.713017255072465,1
188,1900.0,"GURCHAARAN SINGH HAIBOWAL DAIRY COMPLEX, LUDHIANA",PUNJAB,26.0,6.6,7.0,445.5,2.4,1.0,120.0,554.17,62.713017255072465,1
189,1901.0,"DUSSHERA GROUND INDUSTRIAL ESTATE, LUDHIANA",PUNJAB,26.0,6.6,7.0,445.5,2.4,1.0,120.0,554.17,62.713017255072465,1
190,1902.0,"SHUKLA TEA STAL POINT, LUDHIANA",PUNJAB,26.0,6.6,7.0,445.5,2.4,1.0,120.0,554.17,62.713017255072465,1
191,1903.0,"PUNJAB AGRICULTUREAL UNIVERSITY, LUDHIANA",PUNJAB,26.0,6.6,7.0,445.5,2.4,1.05,120.0,554.17,62.718483921739136,1
192,1194.0,KRISHNA AT MAHABALESHWAR DHOM DAM NEAR KOINA DAM,MAHARASHTRA,23.11,5.87,7.73,140.12,4.2,0.22,27.08,215.83,92.55092163768116,0
193,1153.0,KRISHNA AT RAJAPUR WEIR,MAHARASHTRA,27.17,6.62,7.53,497.18,3.11,1.05,7.18,161.82,75.53971713043478,0
194,36.0,"KRISHNA AT KRISHNA BRIDGE, KARAD",MAHARASHTRA,23.21,5.26,7.74,205.38,6.79,0.25,245.83,1783.33,123.78269427246379,0
195,1906.0,KRISHNA D/S OF ISLAMPUR,MAHARASHTRA,22.75,6.67,7.83,455.88,4.87,2.62,5.75,154.17,96.21597498550724,0
196,37.0,KRISHNA AT SANGLI,MAHARASHTRA,22.92,6.53,7.81,773.86,3.15,2.34,5.75,149.17,81.35509899130436,0
197,1310.0,KRISHNA AT KURUNDWAD IN KOLHAPUR,MAHARASHTRA,27.17,6.57,7.57,556.13,3.58,1.56,6.83,162.5,80.69624420869565,0
198,2187.0,KRISHNA AT KSHETRA MAHULI.,MAHARASHTRA,21.65,4.87,7.86,435.18,7.27,0.25,218.33,1558.33,131.38439940289857,0
199,2188.0,"KRISHNA AT KRISHNA-VENNA SANGAM, MAHULI",MAHARASHTRA,21.12,4.99,7.97,407.81,6.87,0.28,237.08,1716.67,129.62236345507247,0
200,2190.0,KRISHNA RIVER AT WAI.,MAHARASHTRA,23.17,4.53,7.85,323.77,8.05,0.3,178.33,1441.67,138.82234632173913,0
201,1182.0,KRISHNA AT U/S OF UGARKHURD BARRAGE,KARNATAKA,25.64,6.55,8.51,689.09,2.07,3.9,571.82,1274.55,96.76036280000001,0
202,1889.0,KRISHNA - ANKALI BRIDGE ALONG CHIKKODI KAGWAD ROAD,KARNATAKA,24.82,6.76,8.52,668.18,1.88,6.02,619.46,1418.18,95.553429257971,0
203,1181.0,KRISHNA AT D/S OF NARAYANPURA DAM,KARNATAKA,27.86,5.47,8.16,440.0,1.5,2.22,229.36,565.46,82.87161633043479,0
204,1170.0,KRISHNA AT D/S OF DEVASAGAR BDG.,KARNATAKA,29.67,7.02,8.32,445.5,2.13,0.51,606.67,1250.0,92.07252830434786,0
205,1028.0,KRISHNA AT TINTINI BRIDGE,KARNATAKA,30.0,7.11,8.22,445.5,1.34,0.58,118.33,306.67,71.91827677681161,1
206,2781.0,KRISHNA AT D/S OF ALAMATTI DAM,KARNATAKA,27.77,5.65,8.19,460.0,1.7,0.58,354.55,860.0,86.95345094202897,0
207,1784.0,"KRISHNA AT THANGADI , MAHABOOBNAGAR",ANDHRA PRADESH,28.45,6.75,7.99,766.46,8.78,0.63,101.67,341.43,135.23180888695651,0
208,1175.0,"KRISHNA A/C TUNGABHADRA, SANGAMESHWARAM",ANDHRA PRADESH,27.64,6.3,7.92,372.27,2.36,2.35,138.4,1086.0,80.42853012463767,0
209,39.0,KRISHNA AT GADWAL BRIDGE,ANDHRA PRADESH,28.09,6.45,7.97,762.09,8.4,0.52,116.67,277.14,133.26847788985506,0
